,text,hoax
1511,Pembinaan Olahraga di Masa Pandemi COVID-19,0
1512,Pikiran Positif Senjata Sita Taklukan Corona,0
1513,Upaya BP2MI Jamin Kepulangan Pekerja Migran Indonesia ke Kampung Halaman,0
1514,BP2MI Antisipasi Peningkatan Gelombang Kepulangan Pekerja Migran Indonesia di Tengah Pandemi COVID-19,0
1515,Prosedur Kepulangan Pekerja Migran di Tengah Pandemi COVID – 19,0
1516,"Angka Positif COVID-19 Bertambah 533 Orang Jadi 13.645, Pasien Sembuh Jadi 2.607",0
1517,Gerakan Kurva Landai Jadi Solusi Penurunan Angka Kasus COVID-19,0
1518,Tidak Mudik Cara Bijak Lindungi Keluarga dari Keterpaparan COVID-19,0
1519,Infografis COVID-19 (9 Mei 2020),0
1520,"Pasien Sembuh COVID-19 Naik Jadi 2.494, Kasus Meninggal 943 Orang",0
1521,Infografis COVID-19 (8 Mei 2020),0
1522,"Pasien Sembuh COVID-19 Jadi 2.381, Konfirmasi Positif 12.776",0
1523,Masyarakat Bisa Belanja Pangan Online Kurangi Kontak Saat COVID-19,0
1524,Gugus Tugas Dorong Masyarakat Manfaatkan Keragaman Pangan Indonesia,0
1525,Ahli Gizi: Ikan Kembung Kaya Akan Omega 3 Gantikan Ikan Salmon,0
1526,Ahli Gizi: Pasien COVID-19 Konsumsi Protein dan Energi Lebih Tinggi,0
1527,Infografis COVID-19 (7 Mei 2020),0
1528,"Soal PSBB, Presiden Jokowi Minta Masyarakat Disiplin dan Ikuti Protokol Kesehatan",0
1529,"Pasien Sembuh COVID-19 Jadi 2.317, Sebanyak 12 Provinsi Nihil Penambahan Kasus Positif",0
1530,Pemerintah Fokus Kendalikan COVID-19 Secepatnya,0
1531,Operasi Ketupat Dilakukan Lebih Awal Sebagai Antisipasi PSBB Cegah COVID-19,0
1532,Pemberian Sanksi Terkait PSBB Adalah Opsi Tindakan Paling Akhir,0
1533,"Mudik Tetap Dilarang, Kemenhub Dukung dan Tindaklanjuti SE Gugus Tugas",0
1534,Infografis COVID-19 (6 Mei 2020),0
1535,Ketua Gugus Tugas Tegaskan Mudik Dilarang dan Tidak Ada Kelonggaran,0
1536,Aliansi Pemuda Surabaya: Dokter garda terakhir penanganan COVID-19,0
1537,Gugas COVID-19: Kaum muda kebanyakan tidak sadar terinfeksi COVID-19,0
1538,"Pasien Sembuh COVID-19 Bertambah 243 Orang, Total 2.197",0
1539,Gugus Tugas: Rasio Tes Indonesia Tidak Bisa Serta Merta Dibandingkan dengan Negara Lain,0
1540,Jubir Pemerintah: COVID-19 Sudah Mulai Dapat Dikendalikan,0
1541,Pemeriksaan Cepat Kunci Sukses Bali Tangani COVID-19,0
1542,Infografis COVID-19 (5 Mei 2020),0
1543,Presiden Jokowi Ajak Negara Gerakan Non-Blok Tingkatkan Solidaritas Politik dalam Melawan COVID-19,0
1544,"Pasien Sembuh COVID-19 Menjadi 1.954, Sebanyak 18 Provinsi Tak Laporkan Kasus Baru",0
1545,Infografis COVID-19 (4 Mei 2020),0
1546,Pegiat: Berkebun Di Ruang Terbatas di Rumah Selama COVID-19,0
1547,Lima Arahan Terbaru Presiden Terkait Penanganan Pandemi COVID-19,0
1548,Menristek: Ventilator untuk Pasien COVID-19 Produksi Indonesia Sebagian Masih Uji Endurance,0
1549,"Kemenristek Uji Klinis Jahe Merah, Jambu Biji, Minyak Kelapa Hingga Pil Kina untuk COVID-19",0
1550,"Pasien Sembuh COVID-19 Bertambah 211 Jadi 1.876, DKI Jakarta Paling Banyak",0
1551,Infografis COVID-19 (3 Mei 2020),0
1552,KPPPA: Mendongeng Bisa Siasati Kebosanan Anak Akibat Dampak COVID-19,0
1553,"Perangi COVID-19, Aplikasi BLC Jadi Gerakan Transparansi Data Percepat Penanganan",0
1554,"Bersatu Lawan COVID, Aplikasi Berbasis Gawai Permudah Masyarakat Antisipasi COVID-19",0
1555,"Rapat Bersama Komisi VI DPR, Kepala Gugus Tugas Ungkap Strategi Baru Penanganan COVID-19",0
1556,"Kasus Terkonfirmasi Positif COVID-19 10.843, Pasien Sembuh Jadi 1.665",0
1557,Infografis COVID-19 (2 Mei 2020),0
1558,Inovasi Guru di Perbatasan Manfaatkan Radio Sebagai Media Belajar Mengajar,0
1559,Kemendikbud: Kolaborasi Kunci Kesuksesan Kegiatan Belajar Mengajar dari Rumah,0
1560,Hardiknas Belajar dari COVID-19 dan Strategi Kemendikbud Tegakkan KBM,0
1561,Langkah Pemerintah dalam Mitigasi COVID-19 di Sektor Ketenagakerjaan,0
1562,"Kasus Positif COVID-19 Bertambah 433 Orang, Pasien Sembuh Jadi 1.591",0
1563,Infografis COVID-19 (1 Mei 2020),0
1564,Elisa Granato kelinci percobaan vaksin kopit di inggris meninggal 2 hari setelah divaksin,1
1565,Pusat Panggilan 119 dan Laman Resmi PDSKJI Kini Bisa Layani Konsultasi Kesehatan Jiwa,0
1566,Psikiater: Batasi Informasi Berita Berlebihan untuk Jaga Kesehatan Jiwa Selama Pandemi COVID-19,0
1567,Kemenkes: Stigma Berkontribusi Terhadap Tingginya Angka Kematian COVID-19,0
1568,Tips Kesehatan Jiwa Menghadapi Situasi Dampak Pandemi COVID-19,0
1569,Gugus Tugas COVID-19 Sudah Distribusikan 1.492.150 APD,0
1570,"Kasus Positif COVID-19 Sentuh Angka 10.118, Pasien Sembuh Naik 1.522 Orang",0
1571,Infografis COVID-19 (30 April 2020),0
1572,Presiden: Pandemi Momen untuk Memperbaiki,0
1573,KemenPAN-RB: ASN Dilarang Mengajukan Cuti Selama COVID-19,0
1574,"KemenPAN-RB: ASN Harus Patuhi Larangan Mudik, Cegah Penularan COVID-19",0
1575,Sebanyak 89 Laboratorium Aktif Periksa COVID-19,0
1576,Transparansi dan Keterbukaan Informasi Melalui Sistem Bersatu Lawan COVID,0
1577,"Kasus Sembuh COVID-19 Naik Jadi 1.391, 12 Provinsi Tidak Laporkan Penambahan Kasus Positif",0
1578,Infografis COVID-19 (29 April 2020),0
1579,Lima Skema Perlindungan dan Pemulihan UMKM di Tengah Pandemi Covid-19,0
1580,Gugus Tugas: Dibutuhkan Lebih Banyak Relawan Medis untuk Tangani COVID-19,0
1581,Kasus Meninggal Akibat COVID-19 Paling Banyak Usia 30-59 Tahun,0
1582,Sistem E-Commerce Jadi Solusi Bagi Pelaku UMKM di Tengah Pandemi COVID-19,0
1583,Pemerintah Uni Emirat Arab Serahkan Bantuan Peralatan Medis untuk Tangani COVID-19 di Tanah Air,0
1584,"Kasus Positif COVID-19 Jadi 9.511, Pasien Sembuh Naik 1.254, Angka Meninggal Terus Melemah",0
1585,Infografis COVID-19 (28 April 2020),0
1586,Presiden: Manajemen dan Distribusi Bahan Pokok Tidak Boleh Terganggu,0
1587,"Kemenkes: Tidak Ditutupi, Begini Alur Validasi dan Penyampaian Data COVID-19 Hingga ke Masyarakat",0
1588,Kemenkeu Beri Dukungan Relaksasi Pajak Sektor Industri di Tengah Pandemi COVID-19,0
1589,"Melalui Layanan Telemedicine, Masyarakat Tak Perlu ke Rumah Sakit",0
1590,Relaksasi Penyampaian Dokumen Kelengkapan SPT Tahunan 2019 di Tengah COVID-19,0
1591,Pemerintah Indonesia Siapkan 10 Ribu Tempat Tidur di 1000 RS Khusus Pasien COVID-19,0
1592,"Pasien Sembuh COVID-19 Naik Jadi 1.151, Sebanyak 19 Provinsi Nihil Penambahan Kasus Positif",0
1593,Infografis COVID-19 (27 April 2020),0
1594,Gugus Tugas Nasional Lakukan Peluncuran Awal Sistem Informasi Bersatu Lawan COVID,0
1595,Stok Pangan Aman Selama Ramadan di Tengah Pandemi COVID-19,0
1596,"Pasien Sembuh COVID-19 Jadi 1.107, Total Kasus Positif 8.882",0
1597,Infografis COVID-19 (26 April 2020),0
1598,"Rindu Ingin Pulang, Perawat COVID-19 Ajak Masyarakat Taati Protokol Kesehatan",0
1599,9 Negara dan Komunitas Internasional Bantu Indonesia Lawan COVID–19,0
1600,Tidak Mudik untuk Cegah Penularan COVID-19,0
1601,Tiga Jenis Peralatan Uji Sampel COVID-19 Mulai Terdistribusi ke Daerah,0
1602,Kementerian PUPR Lanjutkan Penyelesaian RS Akademi UGM Sebagai RS Rujukan COVID-19 di Yogyakarta,0
1603,Menko Polhukam: Jaga Imunitas Jasmani dan Rohani Selama Ramadan di Tengah Pandemi COVID-19,0
1604,Menko Polhukam: Cegah COVID-19 Lebih Penting Daripada Berlomba Meraih Pahala Sunnah,0
1605,Menko Polhukam: Larangan Mudik Berlaku Sejak 24 April 2020,0
1606,"Kasus Positif COVID-19 Capai 8.607 Orang, Pasien Sembuh Meningkat Jadi 1.042",0
1607,Infografis COVID-19 (25 April 2020),0
1608,Presiden Jokowi dan Presiden Trump Sepakat Tingkatkan Kerja Sama Alat Kesehatan dalam Penanganan COVID-19,0
1609,Bantuan PCR Pemerintah Republik Korea Berkapasitas 32.200 Tes,0
1610,Penularan COVID-19 Sangat Mungkin Terjadi dalam Perjalanan Mudik,0
1611,"Pasien Sembuh COVID-19 Tembus Angka 1.002, Kasus Positif 8.211",0
1612,Presiden: Tetap Jalankan Protokol Kesehatan dengan Disiplin,0
1613,Aplikasi Fight COVID-19 Butuh Dukungan Penuh untuk Digunakan Secara Nasional,0
1614,Setiap Pendatang di Babel Dilacak Pergerakannya Pakai Aplikasi Fight COVID-19,0
1615,Kemenhub: Nekat Mudik Akan Diminta Putar Balik,0
1616,"Catat, Ini Jadwal dan Aturan Pemberlakuan Larangan Mudik 2020 dari Pemerintah",0
1617,"Airin: Ada Pemotor Sudah Pakai Masker untuk Cegah COVID-19, Tapi Helm Lupa",0
1618,"Kasus Meninggal Cenderung Turun Sejak Sepekan, Pasien Sembuh COVID-19 Naik Jadi 960",0
1619,Infografis COVID-19 (23 April 2020),0
1620,Kesadaran Bersama Menyikapi Penyebaran COVID-19,0
1621,Jubir Pemerintah: Makna Mudik Tidak Akan Didapatkan Bila Dikarantina,0
1622,Menteri PPPA: 94 Perempuan-26 Anak Positif COVID-19,0
1623,"PEMERINTAH PUTUSKAN MELARANG MUDIK, KEMENHUB SIAPKAN PERMENHUB",0
1624,"Kasus Meninggal COVID-19 Menurun, Pasien Sembuh Bertambah 913 Orang",0
1625,Infografis COVID-19 (22 April 2020),0
1626,Pemerintah Segera Kaji Stimulus bagi Sektor Riil untuk Atasi Dampak Pandemi,0
1627,Jubir Pemerintah: Yakinlah Kita Bisa Lewati Pandemik COVID-19,0
1628,Jubir Pemerintah: Atasi COVID-19 Dengan Putus Rantai Penularan,0
1629,"Pasien Sembuh Bertambah Menjadi 842, Kasus Positif COVID-19 Meluas ke 257 Kabupaten",0
1630,"LBM Eijkman, Laboratorium Tersertifikasi Periksa Sampel Klinis Pasien Terduga COVID-19",0
1631,Infografis COVID-19 (21 April 2020),0
1632,"Stok Pangan Aman, Pemerintah Siapkan Stimulus Bagi Petani Pascapanen Raya",0
1633,"Semangat Kartini Masa Kini, Peran Ganda Perempuan di Tengah Pandemik COVID–19",0
1634,NU: Perempuan Sehatkan dan Perkuat Ketahanan Keluarga Selama COVID-19,0
1635,Presiden: Jaga Bahan Pokok Tetap Tersedia dan Terjangkau oleh Masyarakat,0
1636,Pemerintah Tetapkan Larangan Mudik di Tengah Pandemi COVID-19,0
1637,COVID-19 Dapat Dicegah Dengan Disiplin dan Gotong Royong,0
1638,Presiden Jokowi: Evaluasi dan Perbaiki Pelaksanaan PSBB,0
1639,"Kasus Positif COVID-19 Menurun, Jumlah Pasien Sembuh Terus Melesat Jadi 747 Orang",0
1640,Infografis COVID-19 (20 April 2020),0
1641,"Paket Bantuan Sosial Mulai Disalurkan bagi 1,2 Juta Keluarga Penerima Manfaat di DKI Jakarta",0
1642,Merry Riana: Pandemik COVID-19 Ibarat Masa Ulat Menjadi Kepompong,0
1643,Lebih Dari 84 Ribu Pos Jaga Desa Dibentuk untuk Cegat COVID-19,0
1644,Lebih dari 40 Ribu Desa Bentuk Relawan Desa Lawan COVID-19,0
1645,"Pasien Sembuh Terus Tumbuh Menjadi 686, Kasus Positif COVID-19 Masih Masif",0
1646,Infografis COVID-19 (19 April 2020),0
1647,Perawat: Butuh Satu Jam Tangani Satu Pasien COVID-19,0
1648,Perawat Dibekali Pelatihan Penanganan MERS-CoV Sebelum COVID-19,0
1649,Berbagi Pesan dan Pengalaman Seorang Perawat Pasien COVID–19,0
1650,"Ketidakjujuran Pasien, Petaka Bagi Tenaga Medis",0
1651,Kominfo Pastikan Aplikasi PeduliLindungi Aman Dari Peretas,0
1652,Kominfo: Penyebar Hoaks COVID-19 Diancam Sanksi Kurungan dan Denda 1 Miliar,0
1653,"Pasien Sembuh COVID-19 Terus Bertambah Jadi 631, DKI Jakarta Paling Banyak",0
1654,Infografis COVID-19 (18 April 2020),0
1655,Yosi Project Pop: Saring Sebelum Sharing Tangkal Hoaks COVID-19,0
1656,Ancaman Infodemik Dapat Memperburuk Pandemi COVID-19,0
1657,Informasi Keliru Soal COVID-19 Hanya Menambah Beban Psikologis,0
1658,"Maskerku Melindungi Kamu, Maskermu Melindungi Aku",0
1659,Ramadan di Rumah Tak Mengurangi Kualitas Ibadah,0
1660,"Jumlah Sembuh COVID-19 Bertambah Menjadi 607, Jauhi Angka Kematian 520",0
1661,Infografis COVID-19 (17 April 2020),0
1662,Kemenkes Permudah Penerbitan Izin Edar bagi Industri yang Produksi APD,0
1663,Kemenkes: Penggunaan APD Coverall Disesuaikan Risiko Penularan,0
1664,Ini Beda Spesifikasi Masker Bedah dan N95 Menurut Kemenkes RI,0
1665,Jaring Pengaman Sosial Kurangi Dampak Ekonomi Masyarakat di Tengah Pandemi COVID-19,0
1666,"Cegah COVID-19, Masyarakat Dapat Memanfaatkan Layanan Telemedecine",0
1667,IDI Tekankan Dokter Terus Pantau Kesehatan Warga yang Isolasi Mandiri,0
1668,Pasien Sembuh COVID-19 Naik Signifikan Menjadi 548 Orang,0
1669,Infografis COVID-19 (16 April 2020),0
1670,Suka Duka Relawan Perempuan Satu-Satunya yang Jadi Supir Ambulans,0
1671,Gugus Tugas Bekerja Sama dengan Kalbe Farma Siap Layani 4.000 Tes PCR Gratis,0
1672,Jumlah Relawan COVID-19 Capai 23.472 Orang,0
1673,Gugus Tugas Salurkan Rp200 Miliar Donasi Masyarakat,0
1674,Perlindungan UMKM Guna Menjaga Produktivitas di Tengah Pandemik COVID-19,0
1675,Positif COVID-19 di Indonesia Mencapai 5.136 Kasus dan 446 Pasien Sembuh,0
1676,Presiden Dorong Kemudahan dan Produktivitas Industri Medis untuk Penuhi Kebutuhan Dalam Negeri,0
1677,Infografis COVID-19 (15 April 2020),0
1678,Presiden Siapkan Sejumlah Langkah Mitigasi Lanjutan Dampak COVID-19 Terhadap UMKM,0
1679,Pakar BNPB Ingatkan Masker Kain Sebaiknya Dipakai Maksimal Empat Jam,0
1680,Pentingnya Pakai Masker untuk Melindungi Orang Lain,0
1681,"Data Jumlah ODP Dibuka, Pemerintah Minta Mereka Patuhi Isolasi Diri",0
1682,Pemerintah Tidak Pungut Biaya Penyaluran Insentif Kartu Prakerja,0
1683,"Tiga Hari Diluncurkan, Empat Juta Orang Daftar Program Kartu Prakerja",0
1684,Gugus Tugas Produksi APD Berbahan Lokal Sertifikasi WHO,0
1685,Gugus Tugas Targetkan 78 Laboratorium Uji COVID-19,0
1686,"Kasus Meninggal Karena COVID-19 Jadi 459, Sembuh 426 dan Positif 4.839 Kasus",0
1687,Presiden Jokowi Dorong APT Ciptakan Resiliensi Pandemi COVID-19 dan Resiliensi untuk Penguatan Ekonomi,0
1688,Infografis COVID-19 (14 April 2020),0
1689,Enam Arahan Presiden untuk Bendung Penyebaran COVID-19,0
1690,"Hadapi Dampak COVID-19, Presiden: Tidak Boleh Pesimistis, Hadapi dengan Kerja Keras",0
1691,Presiden: Fokuskan Semua Kekuatan Kita pada Upaya Penanganan COVID-19,0
1692,RRI Hadirkan Guru ke Rumah untuk Anak-anak di Tengah Pandemi COVID-19,0
1693,Presiden Dorong Sinergi dan Kolaborasi antar Negara ASEAN untuk Tangani COVID-19,0
1694,"Bertambah 316 Kasus, Positif COVID-19 di Indonesia Menjadi 4.557 Kasus",0
1695,MPR: Info Penanggulangan COVID-19 Agar Satu Suara,0
1696,Infografis COVID-19 (13 April 2020),0
1697,MUI Ajak Umat Muslim Mendulang Manfaat Ibadah Ramadan di Tengah Pandemi COVID-19,0
1698,Arahan Presiden Soal Manajemen Penanganan Pasien Hingga ‘RS Tanpa Dinding’,0
1699,Perluas Cakupan Pemeriksaan Spesimen dengan Pengujian PCR,0
1700,Jaga Ketersediaan Pangan dan Tumbuhkan Gotong Royong Hadapi Pandemi COVID-19,0
1701,MUI Ajak Umat Muslim Petik Hikmah dari Pandemi COVID-19 Sebagai Rahmat,0
1702,MPR Pahami Antisipasi Defisit Anggaran Lima Persen,0
1703,"Jumlah Pasien Sembuh Meningkat, Gugas Optimis COVID-19 Bisa Disembuhkan dengan Baik",0
1704,Provinsi Banten telah Ajukan Permohonan PSBB kepada Kemenkes RI,0
1705,Infografis COVID-19 (12 April 2020),0
1706,Lakukan Penilaian Mandiri COVID-19 Lewat Aplikasi INARISK,0
1707,"Kasus Sembuh COVID-19 Terus Naik Jadi 359, Sementara Positif 4.241",0
1708,"PGI: Ibadah Paskah di Rumah Selama Pandemi COVID-19, Bagian dari Perayaan Iman Kristus",0
1709,PGI Imbau Penggunaan Gereja Kosong untuk Isolasi COVID-19,0
1710,Menkes Tetapkan PSBB 5 Wilayah di Jabar,0
1711,Kemenhub Terbitkan Peraturan Menteri tentang Pengendalian Transportasi Cegah Penyebaran COVID-19,0
1712,Satu Visi dan Strategi Tangani COVID-19,0
1713,Pemerintah Sudah Periksa Hampir 20.000 Sampel COVID-19,0
1714,Infografis COVID-19 (11 April 2020),0
1715,"Insentif 405,1 Triliun Rupiah di Tengah Wabah",0
1716,Pemerintah Minta Masyarakat Tidak Tolak Jenazah COVID-19,0
1717,"Kasus Positif COVID-19 Meningkat Tajam Menjadi 3.842, Sembuh 286",0
1718,UNICEF: Kepastian Anak Mendapatkan Hak Kesehatan Penting di Tengah COVID-19,0
1719,UNICEF: 70 Persen Anak Percaya Pemerintah Bisa Tangani COVID-19,0
1720,Save The Children Berharap Anak-Anak Diberikan Partisipasi Pengendalian COVID-19,0
1721,KPPPA: Hasil Survei AADC-19 Sebagian Besar Anak Waspada COVID-19,0
1722,Lebih Dari 19.500 Orang Jalani Pemeriksaan COVID-19 di Indonesia,0
1723,"Infeksi COVID-19 telah Menyebar di 34 Provinsi di Indonesia, Total Positif Jadi 3.512 Kasus",0
1724,"COVID-19 Mewabah, Doni Monardo Ingatkan Pentingnya Disiplin Kolektif",0
1725,Infografis COVID-19 (10 April 2020),0
1726,TVRI akan Siarkan Program Belajar dari Rumah di Tengah Pandemi COVID-19,0
1727,Meutya Hafid Ajak Wartawan Peduli Keselamatan Diri,0
1728,PWI: Wartawan Jangan Meliput Tanpa Protokol Kesehatan,0
1729,Kemenag: Selama Ramadan Laksanakan Ibadah di Rumah,0
1730,Dirjen Bimas Buddha Kemenag RI Imbau Perayaan Waisak Dilaksanakan dari Rumah,0
1731,Bimas Katolik Kemenag-Gereja Sepakati Tak Ada Kegiatan Kumpulkan Umat,0
1732,Terima Kasih bagi Semua yang Bergotong Royong #BersatuLawanCOVID19,0
1733,"Pemerintah Larang ASN, TNI, Polri, dan Pegawai BUMN untuk Mudik di Tengah Pandemi COVID-19",0
1734,Presiden: Pengambilan Keputusan Terkait PSBB Harus Hati-Hati,0
1735,Infografis COVID-19 (9 April 2020),0
1736,"Hadapi COVID-19, Gugus Tugas dan TikTok Bersatu Dukung Tenaga Kesehatan",0
1737,Syarat Pemberlakukan PSBB bagi Pemerintah Daerah,0
1738,Polri Tindak 18 Kasus Penyimpangan Produksi dan Distribusi APD,0
1739,Pembuat APD Diharap Ikuti Kualifikasi dan Spesifikasi Bahan,0
1740,Polri Ungkap Angka Kejahatan Menurun Selama Pandemik COVID–19,0
1741,LIPI Latih 800 Relawan untuk Perluas Pemeriksaan Spesimen COVID-19,0
1742,Upaya-Upaya Pemerintah Penuhi Kebutuhan Pokok Masyarakat di Tengah Pandemi COVID-19,0
1743,Pemerintah Membebaskan Pembayaran Bunga dan Penundaan Pembayaran Pokok Paling Lama 6 bulan untuk KUR yang Terdampak COVID-19,0
1744,Empat Strategi Pemerintah Atasi COVID-19,0
1745,Pemerintah Persilakan Daerah Ajukan PSBB,0
1746,Aturan Physical Distancing Terkendala Disiplin Warga,0
1747,"Kasus Sembuh COVID-19 Menjadi 222, Positif 2.956",0
1748,Kominfo: Aplikasi “Peduli Lindungi” Bantu Putus Rantai Penularan COVID-19,0
1749,Infografis COVID-19 (8 April 2020),0
1750,Kominfo Prediksi Bakal Terjadi Kenaikan Traffic Selular Saat Lebaran di Tengah Pandemi COVID-19,0
1751,Mari Gunakan Ruang Digital dengan Cerdas di Tengah Pandemik COVID–19,0
1752,Pentingnya Triase untuk Klasifikasi Pasien Positif COVID-19 Sebelum Dirujuk ke RS Rujukan,0
1753,Gugus Tugas Distribusikan Alat PCR Deteksi COVID–19 ke 12 Provinsi,0
1754,Pemerintah Kini Miliki 20 PCR untuk Tes COVID-19,0
1755,Gugus Tugas Catat Donasi Penanganan COVID-19 Capai Rp83 Miliar,0
1756,Pemerintah Periksa 14.354 Spesimen Terkait COVID-19,0
1757,Gugus Tugas Ingatkan Masyarakat Waspadai DBD Saat Pandemi COVID-19,0
1758,Segera Salurkan Bantuan Sosial dengan Tepat Sasaran,0
1759,Puskesmas Ikut Sediakan Layanan Periksa COVID-19,0
1760,Video Ngeri karena Corona Italia pun Bersujud,1
1761,Menristek BRIN: Ventilator Portabel Karya Anak Bangsa Sedang Diuji Kemenkes,0
1762,Kemenristek BRIN: Pengembangan Vaksin Corona Minimal Satu Tahun,0
1763,Begini Upaya Menristek BRIN Percepat Pengujian Terduga COVID-19 di Indonesia,0
1764,Kemenristek BRIN Bentuk Konsorsium Riset Teknologi Penanganan COVID-19,0
1765,Sebanyak 80 Persen dari 11.242 Pemeriksaan Spesimen Dinyatakan Negatif COVID-19,0
1766,Sebanyak 192 Orang Sembuh Covid-19 dan 2.491 Positif di Indonesia,0
1767,Infografis COVID-19 (6 April 2020),0
1768,Pemerintah Apresiasi Inisiatif Unit Pemda dalam Penanganan COVID-19,0
1769,Risiko Tinggi Jika Berpergian dalam Situasi Pandemi COVID-19,0
1770,Polri: Penegakan Hukum Tetap Kedepankan Physical Distancing,0
1771,Kepolisian RI Lakukan Pencegahan Penyebaran COVID-19 Secara Humanis,0
1772,Achmad Yurianto: Tanpa Keluhan Jadi Parameter Keberhasilan Isolasi Mandiri,0
1773,Kemenkes: Isolasi Diri Menjaga Jarak Fisik,0
1774,Masyarakat yang Lakukan Isolasi Mandiri Harus Lapor Puskesmas,0
1775,Pemerintah Wajibkan Warga Kenakan Masker Saat Beraktivitas di Luar Rumah,0
1776,"Pembebasan Bersyarat Narapidana, Presiden: Narapidana Koruptor Tidak Pernah Dibicarakan",0
1777,Presiden Jokowi Inginkan Kecepatan dalam Pencegahan dan Penanganan COVID-19,0
1778,Infografis COVID-19 (5 April 2020),0
1779,Sebanyak 164 Orang Sembuh dan 2.273 Positif COVID-19 di Indonesia,0
1780,Jubir: Mulai Hari Ini Terapkan #MaskerUntukSemua Saat di Luar,0
1781,Kemenkes: PSBB Batasi Kegiatan Tertentu di Wilayah Terduga COVID-19,0
1782,Gugus Tugas COVID-19: Cairan Disinfektan Tidak Disemprotkan ke Tubuh,0
1783,Kemendes PDTT Sebar Formulir Deteksi Kesehatan Masyarakat Terkait COVID-19,0
1784,Pengendalian Informasi di Level RT/RW dan Desa Menjadi Kunci Pencegahan COVID-19,0
1785,Perangkat Desa Diminta Bentuk Relawan dan Pranata Baru Sebagai Antisipasi Respon Masyarakat Hadapi COVID-19,0
1786,Gugus Tugas Rekomendasikan Standar Penggunaan Masker Cegah COVID–19,0
1787,Psikolog Dorong Orang Tua Terapkan GEMBIRA Hadapi COVID-19,0
1788,Putri Indonesia Beri Dukungan Moril Kepada Gugus Tugas COVID-19,0
1789,Tidak Bepergian Menjadi Kunci Pemutus Rantai Penularan COVID-19,0
1790,"Kasus Sembuh COVID-19 di Indonesia Bertambah 16 Orang, Positif 106",0
1791,Inisiatif Isolasi Mandiri Sebagai Upaya Cegah Penyebaran COVID-19,0
1792,Ketahui Pemulasaran Jenazah Covid-19 yang Benar dan Hindari Khawatir Berlebihan,0
1793,Maklumat Kapolri Mengantisipasi Penyebaran Pandemik COVID-19 di Tengah Masyarakat,0
1794,Begini Pedoman Pengurusan Jenazah COVID-19 Menurut Fatwa MUI,0
1795,"Gugas COVID-19 Distribusikan APD untuk Daerah, Jakarta Terima Terbanyak Disusul Jawa Barat",0
1796,LBM Eijkman Dapat Sumbangan Dana Penanganan COVID-19 Rp10 M,0
1797,Gugus Tugas COVID-19 Apresiasi Kades dan Lurah Isolasi Mandiri Warga,0
1798,"Pasien Sembuh COVID-19 Bertambah 134, Positif 1986",0
1799,Pemerintah Perbanyak Fasilitas Uji Pemeriksaan COVID-19,0
1800,Kemampuan dan Kapasitas Indonesia Produksi APD Penanganan COVID-19 Dipastikan Tercukupi,0
1801,"Doni Monardo Bersama Ketua MPR, Mengajak Masyarakat Gotong Royong dan Bersatu Melawan COVID-19",0
1802,Mensos: Dana Stimulus Rp 405 T untuk Penanganan COVID-19 Tanda Bahwa Negara Hadir,0
1803,"Pasien Sembuh COVID-19 Terus Bertambah Jadi 112, Positif 1.790 Orang",0
1804,"Bahas Persiapan Ramadan, Presiden: Distribusi Logistik Jangan Sampai Terganggu",0
1805,MPR Ajak Masyarakat Disiplin Terapkan Lima Langkah Cegah COVID-19,0
1806,Kiat Bagi Orang Tua Buat Anak Betah Saat #Dirumahaja,0
1807,Pentingnya Kerja Sama Pemerintah Pusat dan Daerah dalam Penanganan COVID-19,0
1808,"Tinjau RS Darurat di Pulau Galang, Presiden: Dioperasikan Mulai Senin Depan",0
1809,Gugas COVID-19 Telah Distribusikan 349 Ribu APD,0
1810,"Dana Rp66,5 Miliar Diterima Gugus Tugas untuk Tangani COVID-19",0
1811,Mekanisme Pemda Terapkan Pembatasan Sosial Berskala Besar Cegah Penyebaran COVID–19,0
1812,Sebanyak 103 Pasien Sembuh dan 1.677 Positif COVID-19 di Indonesia,0
1813,Kebijakan PSBB Pilihan Paling Rasional di Tengah COVID-19,0
1814,"Warga Bisa Gunakan Masker Kain Cegah Antisipasi COVID-19, Asal Jaga Jarak",0
1815,Presiden Jokowi Akan Tinjau RS Darurat di Pulau Galang,0
1816,"Pemerintah Kucurkan Rp405,1 Triliun untuk Tangani Dampak COVID-19",0
1817,Presiden Jokowi Teken Perppu untuk Jaga Kesehatan Masyarakat dan Perekonomian Nasional,0
1818,Infografis COVID-19 (31 Maret 2020),0
1819,"Pencegahan, Penanganan COVID-19 di Desa Andalkan Relawan",0
1820,Pemda Diminta Alirkan Dana Tak Terduga APBD untuk Tangani COVID-19,0
1821,Pemerintah Apresiasi Tenaga Medis Hingga Pengemudi Ojek Daring,0
1822,Gugus Tugas COVID-19 Terima Sumbangan Masyarakat Rp80 Miliar,0
1823,Tim Pakar COVID-19 Tidak Merekomendasikan Penggunaan Ruang Disinfeksi,0
1824,Pakar: Penggunaan Cairan Hand Sanitizer Jangan Berlebihan,0
1825,"Spesialis Paru Tekankan Perlunya Orang Sakit Memakai Masker, Cegah COVID-19",0
1826,"Sebanyak 75 Pasien COVID-19 Sembuh, Kasus Positif 1.414 dan 122 Meninggal",0
1827,Pemerintah Optimis Kebersamaan Seluruh Komponen Bangsa Mampu Lawan COVID-19,0
1828,Pemerintah Siapkan Pengadaan 191.666 APD dalam Penanganan COVID-19,0
1829,Presiden Jokowi Beri Empat Arahan Guna Antisipasi Mudik di Tengah Krisis COVID-19,0
1830,Sebanyak 5.816 Orang Mendaftar Sebagai Relawan COVID-19 Beranda »,0
1831,Berkebun di Rumah Bantu Halau Kebosanan Selama ‘Physical Distancing’,0
1832,Kasus Positif COVID-19 di Indonesia Bertambah Menjadi 1.285,0
1833,Pemerintah Telah Periksa 6.500 Orang Terkait COVID-19,0
1834,"MUI Ingatkan Umat Muslim Hindari Kerumunan, Termasuk Ibadah Berkerumun",0
1835,Pemuka Agama Sepakat Imbau Umat Hindari Kerumunan Cegah COVID-19,0
1836,MUI: Sebaik-Baiknya Shalat Adalah Shalat yang Dilakukan di Rumah,0
1837,Tips Mendonasikan Makanan di tengah Wabah COVID – 19,0
1838,"[Update] – COVID-19 Sabtu: 1.155 Positif, 59 Sembuh, dan 102 Meninggal",0
1839,APD yang Telah Didistribusikan Menjadi Kewenangan Gugus Tugas Daerah,0
1840,Waspadai Penambahan Kasus Melalui Penularan di Tengah Masyarakat,0
1841,Pemanfaatan Layanan Telemedik untuk Pencegahan dan Penanganan COVID – 19,0
1842,Menaker Atur Kebijakan bagi Pelaku Usaha dan Pekerja Hadapi COVID-19,0
1843,RS Darurat COVID-19 Wisma Atlet Bisa Operasikan Dua Tower Tambahan Sebagai Antisipasi Lonjakan Pasien,0
1844,Sosiolog: Agar Masyarakat Galang Bantuan Dukung Tenaga Medis,0
1845,Pemerintah Pusat Minta Pemda Realokasi Dana untuk Darurat Covid-19,0
1846,"Atasi Dampak Covid-19, Kemendagri Dorong Pemda Lakukan Relaksasi Pajak Bagi Dunia Usaha",0
1847,Kemendagri Minta Pemda Prioritaskan Anggaran Darurat Covid-19 Sesuai Peraturan,0
1848,Pemda Diharapkan Perkuat WFH dengan Diiringi Pemenuhan Kebutuhan Dasar,0
1849,Pemerintah Pastikan Persediaan Bahan Pokok Aman dan Tersedia Selama Darurat Covid-19,0
1850,Peran Multipihak Bagian dari Pentaheliks Penanganan Pandemik COVID –19,0
1851,Update Data Link Website Terkait Penanganan COVID-19,0
1852,Arahan Presiden kepada Gubernur Soal Penanganan Covid-19,0
1853,Pedoman Tenaga Medis dan Masyarakat Hadapi Penanganan COVID-19,0
1854,Sebanyak 100 Ribu APD Disalurkan ke Wilayah Skala Prioritas,0
1855,"Ayo, Kaum Milenial Punya Peran Cegah dan Lakukan Kesiapsiagaan COVID – 19",0
1856,566 Pasukan Dikerahkan Dukung Operasional RS Darurat COVID-19 Wisma Atlet Kemayoran,0
1857,Menhan Serahkan Bantuan Tiongkok ke Gugus Tugas COVID–19,0
1858,Wapres Minta MUI Rilis Fatwa Tangani Jenazah COVID-19 dan Tata Cara Ibadah Bagi Petugas Medis,0
1859,"Cegah Covid-19, Wapres Minta Semua Masyarakat Taati Imbauan Pemerintah",0
1860,Kasus Positif Covid-19 di Indonesia Bertambah Menjadi 579,0
1861,Komnas HAM Merestui Tindakan Tim Gugus Tugas dalam Penanganan COVID19,0
1862,"Tingkatkan kekebalan tubuh,kurangi risiko COVID-19",0
1863,Anjuran Berbelanja Ketika Menjalankan “Social Distancing”,0
