,text,hoax
736,Tujuh Langkah Protokol Kesehatan Pengguna Moda Transportasi Umum,0
737,Pelarangan WNA Masuk Ke Indonesia Diperpanjang,0
738,Ancaman Infodemik Dapat Memperburuk Pandemi COVID-19,0
739,Pemerintah Kawal Kesiapan Sarana Vaksin COVID-19,0
740,Pemerintah Pastikan Kesiapan Vaksinasi,0
741,Program Pemulihan Ekonomi Nasional (PEN) Mendukung UMKM di Masa Pandemi,0
742,Pemerintah Terus Tingkatkan Kuantitas dan Kualitas Pelayanan Kesehatan Selama Tahun 2020,0
743,Infografis COVID-19 (13 Mei 2020),0
744,"Antisipasi Varian Baru Covid-19, Pemerintah Tutup Sementara Perjalanan WNA ke Indonesia",0
745,"Kasus Positif COVID-19 Jadi 14.265, Pasien Sembuh 2.881 Orang",0
746,Pemakaian Masker Menyebabkan Penyakit Legionnaires,1
747,Pesan Berantai Wisma Atlet penuh,1
748,Kemenparekraf Kembali Sumbang APD Penanganan COVID – 19,0
749,Kepolisian RI Lakukan Pencegahan Penyebaran COVID-19 Secara Humanis,0
750,Presiden Jokowi Inginkan Kecepatan dalam Pencegahan dan Penanganan COVID-19,0
751,Penanganan Covid-19 Harus Tekan Penularan Kasus,0
752,Dukungan Kolektif Masyarakat Kampanye Penggunaan Masker Lawan COVID-19,0
753,Pandemi COVID-19 Tumbuhkan Semangat Berkreativitas Atlet dan Musisi,0
754,Video Biden Merayakan Ulang Tahun Tanpa Masker,1
755,Sejumlah Polisi India Telah Tiba di Indonesia,1
756,Pemkot Semarang Kondisikan Sikap Adaptif Warga Terhadap COVID-19,0
757,Kasus Meninggal Akibat COVID-19 Paling Banyak Usia 30-59 Tahun,0
758,"Peningkatan Penanganan COVID-19 di Jawa Timur dan Sulawesi Selatan, Berhasil Keluar dari Zona Merah",0
759,Tidak Ada Pasien Positif Corona di Aceh,1
760,"Video Sholat Jum’atan di China Menjadi Lautan Manusia, Orang Islam di Wuhan Tidak Satupun yang Kena Virus Corona",1
761,Instruksi Bupati Malang Izinkan Lomba Agustusan dan Kegiatan yang Datangkan Massa,1
762,"Pasien Sembuh Terus Bertambah, Kesembuhan Total Menjadi 441.983 Orang",0
763,MUI Larang Penggunaan Vaksin Covid-19 yang Didatangkan dari Tiongkok,1
764,Satgas Covid Ingatkan Masyarakat Untuk Tetap Jalankan Protokol Kesehatan,0
765,"Kasus Terkonfirmasi Positif COVID-19 Naik 496 Orang, Pasien Sembuh Meningkat Jadi 4.324",0
766,Infografis COVID-19 (16 Juni 2020),0
767,112 Wilayah Administrasi Kabupaten dan Kota Masuk Daftar Zona Hijau,0
768,UNICEF: 70 Persen Anak Percaya Pemerintah Bisa Tangani COVID-19,0
769,Pasien Sembuh dari COVID-19 Bertambah Menjadi 297.509 Orang,0
770,Bill Gates mengatakan dia tidak akan divaksinasi dan CEO Pfizer juga menunda menerima vaksin covid-19,1
771,Pasien Sembuh Melampaui Penambahan Pasien Terkonfirmasi Poisitif,0
772,Video Demonstrasi Anti Lockdown di London,1
773,Salah Satu Solusi untuk Virus Ini adalah Secangkir Teh Sederhana,1
774,Presiden: Tetap Jalankan Protokol Kesehatan dengan Disiplin,0
775,"Penambahan Kasus COVID-19 Terkonfirmasi Positif 1.447, Meninggal 53 dan Sembuh 651 Orang",0
776,"Sejumlah Negara Tak Izinkan WNI Datang, Wamenlu: RI Juga Larang WNA Masuk Saat Corona, kecuali TKA China",1
777,Sidak Masker di Wilayah Kabupaten Jepara Hingga 31 Desember 2020,1
778,"Penanganan Jenazah di Masa Pandemi, Perhatikan Protokol ini",0
779,Pasien Sembuh Tembus Angka 301.006 Orang,0
780,Pemerintah Periksa 14.354 Spesimen Terkait COVID-19,0
781,Foto FBI Menangkap Bill Gates Karena Terorisme Biologis,1
782,Aktris Olla Ramlan Tetap Produktif Saat Pandemi,0
783,Satgas Covid-19 Ingatkan Masyarakat Disiplin Terapkan 3M,0
784,Seorang Kakek di Tulungagung Meninggal Karena COVID-19,1
785,Lima Arahan Terbaru Presiden Terkait Penanganan Pandemi COVID-19,0
786,Cegah Klaster Kantor Lewat Disiplin 3M,0
787,Kesembuhan COVID-19 di Jawa Tengah Meningkat,0
788,Komnas HAM Merestui Tindakan Tim Gugus Tugas dalam Penanganan COVID19,0
789,"Ditanya Soal Virus Corona Korlap FPI: Hanya Imam Besar Kami yg Punya Penangkal Virus Corona, Karna Imam Besar Kami Cucu Nabi",1
790,Satgas Ajak Masyarakat Bijak Pilah Informasi Dukung Suksesnya Vaksinasi,0
791,Pasar-Pasar Tradisional di Tanjung Karang & Teluk Betung Mulai Besok Ada yang Tutup 3 Hari SD 5 Hari,1
792,Hati2 Alat Ini Sdh Di Setting Suhu 36-37°C Olh Komunis Cina Utk Mmbunuh Para Ulama2 Kita,1
793,Jumlah Testing Pekan Ketiga November Dekati Standar WHO,0
794,236 Anggota Polisi Positif Covid-19 dan 6 Orang Meninggal Dunia,1
795,Pancasila Jadi Penggerak dan Pemersatu Bangsa dalam Menghadapi Tantangan dan Ujian,0
796,Perayaan Kegiatan Keagamaan Diminta Terapkan Protokol Kesehatan,0
797,"Bapak Ibu Meninggal Karena Covid-19, 5 Bersaudara Menunggu Diadopsi",1
798,Tips Cuci Tangan yang Benar Mengusir Kuman,0
799,Infografis COVID-19 (25 Juli 2020),0
800,Corona Adalah Kedok dari Penyakit Radiasi,1
801,Ahli Gizi: Ikan Kembung Kaya Akan Omega 3 Gantikan Ikan Salmon,0
802,Papua Masuk Lima Besar Kesembuhan Harian Tertinggi,0
803,"Lakukan Disinfeksi Atasi COVID-19 secara Aman, Perhatikan Beberapa Prosedur",0
804,"Vaksinasi Penting di Masa Pandemi, Dorong Terciptanya Kekebalan Kelompok",0
805,dr Reisa: Pasien COVID-19 Dengan Gejala Berat Bisa Sembuh,0
806,Ibadah Natal Harus Utamakan Kesehatan dan Keselamatan Jemaat,0
807,Presiden Akan Tinjau Posko Penanganan dan Penanggulangan COVID-19 Jawa Timur,0
808,Pemeringkatan Provinsi Permudah Monitoring Penanganan COVID-19,0
809,Digitalisasi Dongkrak UMKM Naik Kelas,0
810,Satgas Minta Masyarakat Cermat Pilah Informasi Terkait Vaksin COVID-19,0
811,Hydro Oxy Mouth Freshener Spray Dapat Cegah dan Sembuhkan Virus Covid-19,1
812,Tantangan Pengobatan Penderita ODHA di Tengah Pandemi COVID-19,0
813,"Berkunjung ke Markas Satgas COVID-19, Pendeta Midian Sirait: Mari Bantu Pemerintah Atasi COVID-19",0
814,Provinsi Prioritas Harus Tingkatkan Kesembuhan dan Tekan Kematian,0
815,Kasus Sembuh Mingguan di Empat Provinsi Jauh Lebih Baik,0
816,Flat Isolasi Mandiri Wisma Atlet Kemayoran Terisi 1.709 OTG,0
817,Pembatasan 50 Persen Pengunjung Pusat Belanja di Masa PSBB Transisi Wilayah Jakarta,0
818,Tips Hindari COVID-19 di Pondok Pesantren,0
819,Pasien Sembuh Harian Bertambah 4.545 Orang,0
820,Kesembuhan COVID-19 Terus Bertambah Menjadi 445.793 Orang,0
821,Protokol Kesehatan Penting untuk Keselamatan Ibu Hamil,0
822,Gambar Tangkapan Layar Berita Viva.co.id Berjudul Kementan Produksi Massal Kalung Antivirus Corona Bulan Depan Dengan Foto Headline Kalung Bertaring,1
823,BP2MI Antisipasi Peningkatan Gelombang Kepulangan Pekerja Migran Indonesia di Tengah Pandemi COVID-19,0
824,"Fabiana Souza, penerima perdana suntikan vaksin covid 19 meninggal dunia di RS.Sao Lucas Porto Alegre Brazil Selatan",1
825,Awas HOAKS! - Harga Vaksin di Indonesia 1000% Lebih Mahal daripada di Brazil,0
826,Foto Ariel NOAH Jadi Relawan Tenaga Medis di Tengah Pandemi Virus Corona atau Covid-19,1
827,440 Ribu Nakes dan 23 Ribu Vaksinator Persiapkan Vaksinasi,0
828,Cie ga pake masker cie berdekatan cie lupa ada corona cie selfi bareng,1
829,Kemandirian Desa Panggungharjo Hadapi Pandemi dengan Kearifan Lokal Setempat,0
830,Satgas COVID-19 Imbau Penerapan Protokol Kesehatan di Perkantoran,0
831,"Foto Barack Obama, Anthony Fauci dan Melinda Gates mengunjungi ‘pabrik coronavirus’ Laboratorium Cina Wuhan tahun 2015",1
832,[FALSE] “Corona Mass Graves in Italy”,1
833,Satgas COVID-19: PSBM Menekan Mobilitas Penduduk Zona Merah,0
834,Infografis COVID-19 (4 September 2020),0
835,Bukan Karena Vaksin COVID-19 Respon Vagal Sebabkan Seorang Perawat Pingsan,0
836,Presiden Jokowi dan Presiden Trump Sepakat Tingkatkan Kerja Sama Alat Kesehatan dalam Penanganan COVID-19,0
837,Imam Besar Masjid Istiqlal Minta Santri Proaktif Mengusir COVID-19,0
838,Puncak Persebaran Virus Corona 4 April Hingga 18 April 2020,1
839,Menteri Kesehatan: Pelaksanaan Vaksinasi Menunggu Izin Penggunaan dari Badan POM,0
840,Media Jadi Solusi Keberhasilan Penanganan COVID-19,0
841,Pesan WhatsApp Soal Razia Keliling Serempak Se-Jawa Barat,1
842,Transmart Ditutup Selama 10 Hari Karena Belasan Orang Terpapar Covid-19,1
843,Pasien Covid-19 Meninggal di Rumah Sakit Manaf Kota Jambi,1
844,KJP Dicabut dan Kurungan 3 Bulan bagi Anak-Anak yang Keluar Rumah Selama PSBB,1
845,Infografis COVID-19 (29 Agustus 2020),0
846,Pesan Berantai Rekrutmen Relawan Untuk Merawat Pasien Covid 19 di Wisma Atlet Oleh Dokter Irna,1
847,Monitoring Kepatuhan Protokol Kesehatan di 34 Provinsi Indonesia (Update Per 10 Januari 2021),0
848,Menko Polhukam: Jaga Imunitas Jasmani dan Rohani Selama Ramadan di Tengah Pandemi COVID-19,0
849,Satgas COVID-19 Sebut Laboratorium Perlu Dievalusi,0
850,"Zona Merah Semakin Berkurang, Tim Pakar: Masyarakat Diharapkan Tetap Waspada",0
851,Vaksin Penting untuk Membangun Imunitas Masyarakat,0
852,Lima Skema Perlindungan dan Pemulihan UMKM di Tengah Pandemi Covid-19,0
853,"Pasien Sembuh COVID-19 Terus Tumbuh Jadi 17.883, Kasus Positif Naik 1.226",0
854,Penanganan COVID-19 di 10 Provinsi Prioritas Semakin Membaik,0
855,Jubir Pemerintah: Atasi COVID-19 Dengan Putus Rantai Penularan,0
856,"71 Pasien Covid-19 Klaster Hajatan Boyolali Dijemput Petugas, Biaya Dibebankan ke Pemilik Hajatan",1
857,Indonesia Berupaya Amankan Ketersediaan Vaksin COVID-19,0
858,Penambahan Pasien Sembuh Harian Capai 2.317 Orang,0
859,Infografis COVID-19 (29 Mei 2020),0
860,"Kasus COVID-19 Bertambah 1.014, Pasien Sembuh Juga Naik Menjadi 13.776",0
861,Pastikan Sikap Disiplin Sebelum Memulai Aktivitas di Masa Pandemi,0
862,"Kasus Positif COVID-19 Capai 8.607 Orang, Pasien Sembuh Meningkat Jadi 1.042",0
863,Pemerintah Persilakan Daerah Ajukan PSBB,0
864,Keputusan Menteri Kesehatan Republik Indonesia nomor 9860 Tahun 2020,0
865,Belajar Strategi Penanganan Pandemi Dari Masa Lalu,0
866,Himbauan Bpk Kapolresta Malang Siapapun yg Bukan Orang Malang klo Ada yg Masuk Ke kota Akan Dikarantina Selama 14 hri,1
867,Data menunjukkan ACEH hanya 1 korban,1
868,Jokowi: Hukuman Seumur Hidup Bagi Kepala Daerah Mainkan Bantuan Covid-19,1
869,Denda Rp250 Ribu Saat Razia Masker Tanggal 22 Juni 2020,1
870,Infografis COVID-19 (22 Agustus 2020),0
871,LP3KD Dukung Sosialisasi Adaptasi Kehidupan Baru COVID-19 Lewat Dua Lagu,0
872,Pasien Sembuh Kumulatif Terus Bertambah Menjadi 364.417 Orang,0
873,"Adidas Tawarkan 3100 Sepatu Gratis, T-shirt, dan Masker sebagai Perayaan Hari Jadi Adidas",1
874,Seorang Pesepeda Meninggal Di Monas Akibat Kehabisan Oksigen Karena Memakai Masker,1
875,Satgas Covid-19 Kabupaten Pangkep Semprot Jemaah Shalat Tarawih di Masjid,1
876,Pemerintah Siapkan Kebutuhan Penanganan Pasien COVID-19,0
877,Pengawasan Mutu Vaksin COVID-19 Menerapkan Standar Internasional,0
878,Infografis COVID-19 (26 Juni 2020),0
879,21% Pasien Mengalami Efek Samping Setelah Memakai Vaksin Moderna,1
880,Tiga Langkah Jitu Bagi Daerah untuk Beralih ke Zona Hijau,0
881,Uap Air Panas Dapat Membunuh Virus Corona,1
882,Tidak Menggunakan Masker Denda Rp300 Ribu di Semarang,1
883,Analisis Data COVID-19 Indonesia (Update Per 15 November 2020),0
884,Tekan Penularan Dengan Protokol Kesehatan Di 10 Provinsi Kenaikan Kasus Tertinggi,0
885,"Kasus Positif COVID-19 Naik 684, Pasien Sembuh 471, Meninggal 35",0
886,Penggunaan Hydroxychloroquine Bersyarat pada Pengobatan Pasien COVID-19,0
887,WHO Beri Rekomendasi Untuk Indonesia Menyelenggarakan Rapid Test Antigen,0
888,Video Keadaan RS Covid Wisma Atlet,1
889,"Lima Hotel Isolasi Mandiri DKI Terisi 658 OTG, Kota Tangerang Siapkan Satu Hotel",0
890,Beberapa Dampak Negatif dari Menggunakan Masker,1
891,Pikiran Positif Senjata Sita Taklukan Corona,0
892,Infografis COVID-19 (30 November 2020),0
893,Dubes RI untuk Uni Emirat Arab: Dengan Vaksin Insya Allah Kita Akan Sehat,0
894,Tenaga Medis di Sampang Sengaja Sebarkan Corona Dengan Disuntik,1
895,IDI Tekankan Dokter Terus Pantau Kesehatan Warga yang Isolasi Mandiri,0
896,Video ini di PGC Evakuasi Pasien COVID-19,1
897,[Top 5] Topik Teratas Periksa Fakta MAFINDO Periode 4-10 April 2020,1
898,Purworejo Lockdown Mulai Tanggal 24 Desember 2020,1
899,"Kemenristek/BRIN Siap Bantu Hilirisasi dan Komersialisasi Ventilator serta Kembangkan Vaksin Nasional dengan Prinsip Cepat, Efektif, dan Mandiri",0
900,Presiden Jokowi Beri Arahan Khusus Penanganan COVID-19 di Tiga Provinsi,0
901,Pemerintah Bantu Peningkatan Asupan Gizi Tenaga Kesehatan dan Non-Tenaga Kesehatan yang Bukan ASN di 34 Provinsi,0
902,Perkembangan Testing Nasional Jadikan Bahan Evaluasi,0
903,Tenaga Medis China Didatangkan untuk Membantu Menangani Covid-19 di Indonesia,1
904,Presiden Ajak Para Gubernur Kerja Keras Tangani Pandemi COVID-19,0
905,Poster Pageblug Sultan HB X Anjurkan Masak Sayur Lodeh 7 Warna,1
906,Akselerasi Persiapan Logistik dan SDM Untuk Vaksinasi COVID-19,0
907,Seperti Inilah Bentuk Corona yang Berhasil Difoto dan Diperbesar Ilmuwan India,1
908,MUI Minta Pelaksanaan Zakat Perhatikan Protokol Kesehatan,0
909,Satgas Ingatkan Masyarakat Cegah Kenaikan Kasus Dengan Disiplin 3M Selama Libur Panjang,0
910,Gugus Tugas Nasional Hadirkan Dua Mobile Combat COVID-19 di Jawa Timur,0
911,"Satgas PEN: Banpres Produktif Dorong Usaha Mikro Bertahan, Beradaptasi, dan Berinovasi di Tengah Pandemi",0
912,"Corona Mewabah, Gubernur Ganjar Liburkan Driver Grab Grobogan dan Akan Diajukan oleh Pihak Grab untuk Memberi Insetif 200rb per Hari.",1
913,Vaksin COVID-19 Dapat Mengubah DNA Manusia,1
914,Satgas Covid-19: Vaksin Menstimulasi Imunitas Tubuh,0
915,Yuri: Kasus Sembuh COVID-19 Lebih Banyak Dilaporkan Daerah,0
916,"Pemerintah Luncurkan Subsidi Upah untuk Dorong Daya Beli, Cakupan Diperluas Jadi 15,72 Juta Pekerja   ",0
917,Infografis COVID-19 (12 Agustus 2020),0
918,Rumus Maman: Adaptif dan Kreatif plus Kolaboratif,0
919,Infografis COVID-19 (27 Juni 2020),0
920,"Pasien Sembuh COVID-19 Bertambah 134, Positif 1986",0
921,Dua orang Terinfeksi Virus Corona Di Parepare,1
922,Hardiknas Belajar dari COVID-19 dan Strategi Kemendikbud Tegakkan KBM,0
923,Vaksin COVID-19 Dipastikan Aman Sebelum Diberikan Kepada Masyarakat,0
924,"Penambahan Kasus COVID-19, Positif 1.385, Meninggal 58 dan Sembuh 789 Orang",0
925,Infografis COVID-19 (30 Agustus 2020),0
926,Hasil Survey : Masyarakat Indonesia Optimistis Ekonomi Segera Pulih,0
927,Satgas Penanganan COVID-19 Sebut Zona Risiko Tinggi di 33 KabupatenKota Menurun,0
928,Infografis COVID-19 (31 Juli 2020),0
929,Analisis Data COVID-19 Indonesia (Update Per 6 Desember 2020),0
930,Save The Children Berharap Anak-Anak Diberikan Partisipasi Pengendalian COVID-19,0
931,Video Masjid/ mushola ditutup tpi knp ngadain konser cuk,1
932,Infografis COVID-19 (22 April 2020),0
933,"Perangi COVID-19, Aplikasi BLC Jadi Gerakan Transparansi Data Percepat Penanganan",0
934,"Jumlah Kasus Positif COVID-19 Naik 1.574, Meninggal 76 dan Sembuh 1.295 Orang",0
935,Pasien Sembuh COVID-19 Meningkat Menjadi 666.883 Orang,0
936,Video DI BALIK COVID-19/CORONA TERNYATA ISI NYA SUDAH HABIS,1
937,Terapkan Ini Agar Sukses Hadapi Dampak Pandemi COVID-19,0
938,Pemerintah Pusat Dan Daerah Intensifkan Sinkronisasi Data Covid-19,0
939,Pemerintah Kanada Beri $2.000 Kepada Seluruh Warga Kanada,1
940,Pasien Sembuh Sudah Mencapai 277.544 Orang,0
941,Profesor Dr Tasuku Honjo mengatakan bahwa virus korona itu tidak alami. Cina telah membuatnya,1
942,Tenaga Kesehatan Sasaran Pertama Vaksinasi COVID-19,0
943,"Perkembangan COVID-19 Jabar, Ridwan Kamil: Ekonomi dan Kesehatan Sama-sama Membaik",0
944,566 Pasukan Dikerahkan Dukung Operasional RS Darurat COVID-19 Wisma Atlet Kemayoran,0
945,Jumlah Kasus Aktif Di Berbagai Daerah Cenderung Menurun,0
946,Video Saksikan Konser Amal Corona Bersama Mike Klepon,1
947,Sebanyak 80 Persen dari 11.242 Pemeriksaan Spesimen Dinyatakan Negatif COVID-19,0
948,Pasien Sembuh Kumulatif Mencapai 360.705 Orang,0
949,Vaksin COVID-19 Buatan Sinovac hanya untuk Uji Klinik dan Mengandung Sel Vero dan Bahan Berbahaya,1
950,Pemerintah Sudah Periksa Hampir 20.000 Sampel COVID-19,0
951,Pasien Sembuh Dari Covid-19 Terus Bertambah Menjadi 385.094 Orang,0
952,"Vaksin COVID-19 Disiapkan, 3M & 3T Terus Dijalankan",0
953,Tahap-tahap Pengembangan Vaksin COVID-19 Hingga Produksi Massal,0
954,"Vaksin Sinovac Teruji Minim Efek Samping, Berkhasiat dan Halal",0
955,[BERITA] Update Status Terkait Penutupan Beberapa Destinasi Wisata di DIY,1
956,Ivermectin Obat Covid-19,1
957,Pemerintah Siapkan Stimulus Tambahan Bagi Pekerja untuk Dorong Konsumsi Masyarakat,0
958,Kesembuhan Harian Tembus Angka 4.343 Kasus,0
959,Aturan Physical Distancing Terkendala Disiplin Warga,0
960,Infografis COVID-19 (18 Juni 2020),0
961,"Pasien Sembuh COVID-19 Meningkat Jadi 17.349, Meninggal Bertambah 34, Positif Naik 1.041 Orang",0
962,"Pasien Sembuh COVID-19 Meningkat 3.064, Kasus Meninggal Tembus Angka 1.007",0
963,"Insentif 405,1 Triliun Rupiah di Tengah Wabah",0
964,KRN PEMERINTAHNYA NGEYEL & RAKYATNYA BANDEL AKHIRNYA INDONESIA DILOCKDOWN DUNIA,1
965,"Daftar List Hotel di Bali yg Dijual, Hotel for SALE in BALI April 2020",1
966,Yosi Project Pop: Saring Sebelum Sharing Tangkal Hoaks COVID-19,0
967,"Pekerja Migran Kembali ke Tanah Air, Gugus Tugas Bantu Penanganan",0
968,"Terjadi Kenaikan Jumlah Pasien, Prof Wiku: Peringatan Penanganan Covid-19",0
969,Antisipasi Libur Panjang Karyawan Pergi ke Zona Merah Wajib Lapor,0
970,Anies: Perpanjangan PSBB DKI Jakarta Jadi Penentu Transisi untuk Memulai New Normal,0
971,Resep Campuran Teh Hijau dan Lemon Untuk Atasi Covid-19,1
972,Pasien Sembuh di Flat Isolasi Mandiri 145 OTG,0
973,penerimaan sampel COVID-19 di BBTKLPP Jakarta akan libur pada Hari Raya Idul Fitri,1
974,Enam Arahan Presiden untuk Bendung Penyebaran COVID-19,0
975,"Apa itu: Vaksin, Vaksinasi, Imunisasi dan Imunitas?",0
976,Program-program Imunisasi di Indonesia Terbukti Berhasil Cegah Penyakit Menular,0
977,Keputusan Menteri Kesehatan Republik Indonesia Nomor Hk.01.07/Menkes/12757/2020,0
978,Waspadai Potensi Penyebaran Baru pada Ruang Publik,0
979,Pedagang di Pasar Mayestik Meninggal Karena Covid-19,1
980,Kemendikbud Luncurkan Tiga Kebijakan Dukung Mahasiswa dan Sekolah Terdampak COVID-19,0
981,Jubir Pemrintah: Mari Jalani Pola Hidup Baru dan Berdamai dengan COVID-19,0
982,"Tahapan Vaksinasi COVID-19, Tunggu Evaluasi Badan POM dan MUI",0
983,Infografis COVID-19 (1 Mei 2020),0
984,Flat Isolasi Mandiri Terisi 2.122 OTG dan RS Darurat COVID-19 2.407 Pasien,0
985,"Idul Adha di Tengah Pandemi, Ibadah Kurban Bagi Fakir Miskin dan Keluarga Terdampak",0
986,Menristek BRIN: Ventilator Portabel Karya Anak Bangsa Sedang Diuji Kemenkes,0
987,Kasus Positif COVID-19 di Indonesia Bertambah Menjadi 1.285,0
988,Donasi Bahan Iftar dan Sahur di Masa Wabah Covid-19 oleh PKS,1
989,Perayaan Idul Adha dengan Penerapan Protokol Kesehatan di Masa Pandemi COVID-19,0
990,Suara Orang Terdekat Percepat Kesembuhan Pasien COVID-19,0
991,Satgas COVID-19: Jaga Ketersediaan Alat Material Kesehatan di Daerah,0
992,Setengah Karyawan BTC Pangkalpinang Positif Covid-19,1
993,Masker dapat Menyebabkan Infeksi Staph,1
994,Kesembuhan Kumulatif Covid-19 Terus Bertambah Menjadi 425.313 Orang,0
995,Infografis COVID-19 (14 Juli 2020),0
996,"Atasi Dampak Covid-19, Kemendagri Dorong Pemda Lakukan Relaksasi Pajak Bagi Dunia Usaha",0
997,Masyarakat Tetap Disiplin 3M Setelah Vaksin Tiba,0
998,Infografis COVID-19 (30 Mei 2020),0
999,Sejahtera Secara Psikologis Modal Utama Lawan Corona,0
1000,Sebanyak 11 Provinsi Laporkan Tidak Ada Penambahan Kasus Positif COVID-19,0
1001,Pasien Sembuh Bertambah 1.599 Orang,0
1002,"Jabar di Tengah Pandemi, Dewi: Tidak Termasuk dengan Kasus dan Laju Insidensi Tertinggi ",0
1003,[BERITA] Menara Jaringan Telekomunikasi 5G di Inggris Dibakar karena Hoax Virus Corona,1
1004,Erdogan Tak akan Tutup Mesjid di Turki Selama Pandemi Covid-19,1
1005,Dokter RSAL Surabaya Meninggal akibat Covid-19,1
1006,"Kebijakan Ticketmaster, Wajibkan Vaksin Covid-19 Sebelum Menghadiri Konser",1
1007,Hari ini 2 kasir Chandra karang dinyatakan positive Covid 19,1
1008,Apakah Vaksin Digunakan Untuk Mengobati Orang Sakit?,0
1009,Infografis COVID-19 (15 Agustus 2020),0
1010,Dibalik Kesuksesan Kabupaten Sitaro Raih Zero COVID-19,0
1011,Persatuan Perawat Nasional Indonesia (PPNI) Dukung Vaksinasi COVID-19,0
1012,Belum Ada Obat Spesifik Untuk COVID-19,0
1013,Sekretariat Presiden Gelar Latihan Penaikan Bendera Upacara HUT ke-75 Kemerdekaan RI,0
1014,Ditemukannya Virus Corona atau COVID-19 di Tisu Toilet,1
1015,sakit mendadak oleh vaksin,1
1016,Kesembuhan Harian Meningkat Pesat di Maluku Utara,0
1017,Apakah Vaksin COVID-19 Nanti Juga Tersedia Untuk Anak-Anak?,0
1018,Syarat Pemberlakukan PSBB bagi Pemerintah Daerah,0
1019,"Pusat Kebugaran Dibuka, Begini Tips Agar Tetap Aman Dari Penularan COVID-19",0
1020,BPOM Bagi Resep Pangan Aman Selama Masa Pandemi COVID-19,0
1021,Vaksin Meningkatkan Imunitas Tubuh,0
1022,"Kasus Terkonfirmasi Positif COVID-19 Bertambah 862, Pasien Sembuh Naik Jadi 18.404 Orang",0
1023,Stok Pangan Aman Selama Ramadan di Tengah Pandemi COVID-19,0
1024,Penerima Vaksin Perdana Meninggal Dunia Usai Disuntik Vaksin Pfizer,1
1025,Orang yang Shalat Aman dari Corona,1
1026,Pemimpin Masyarakat Adat Asli Amerika Dikorbankan Sebagai Persembahan Selama Epidemi,1
1027,Infografis COVID-19 (6 April 2020),0
1028,COVID-19 sudah Sampai Purwakarta,1
1029,"Gubernur Kalsel: Pakai Masker, Kita Selamat",0
1030,Pasien Isolasi Harian dan ICU di 98 RS Rujukan COVID-19 DKI Jakarta Turun 22%,0
1031,Analisa Data Terintegrasi Sebagai Landasan Pemulihan Aktivitas Masyarakat Produktif dan Aman COVID-19,0
1032,Pasien Sembuh Bertambah Lagi Sebanyak 4.048 Orang,0
1033,Film Asal Korea Prediksi COVID-19,1
1034,Satgas COVID-19 Sebut Belum Ada Obat untuk COVID-19,0
1035,Kesembuhan Harian Tembus Angka 4.088 Kasus,0
1036,Badan POM Pastikan Keamanan dan Khasiat Vaksin COVID-19,0
1037,Menristek/Kepala BRIN Dorong Inovasi Teknologi Antariksa dan Explorasi dengan Melibatkan R & D Pihak Swasta untuk Kesejahteraan Bangsa,0
1038,Foto Viral! Beredar Foto Anies Jenguk Rizieq yang Positif Covid-19,1
1039,Angka Kesembuhan COVID-19 Terus Meningkat Mencapai 652.513 Orang,0
1040,Media Massa Punya Andil Besar dalam Melawan dan Mengakhiri COVID-19,0
1041,Memakai Masker Dapat Menyebabkan Kematian Akibat Keracunan Karbon Dioksida (CO2),1
1042,Larangan Keluar Rumah Karena Puncak Penyebaran Virus Corona,1
1043,Infografis COVID-19 (21 Juli 2020),0
1044,Perdana Menteri Jepang Mundur Karena Terkait Virus Corona,1
1045,Infografis COVID-19 (08 Juli 2020),0
1046,Satgas Bentuk Bidang Perlindungan Khusus Untuk Keselamatan Tenaga Medis Dan Kesehatan,0
1047,Italia mengalahkan COVID-19 Koagulasi intravaskular diseminata (Trombosis),1
1048,Pasien Sembuh COVID-19 Menjadi 322.248 Orang,0
1049,Satgas COVID-19 - Kemenristek BRIN Kembangkan Health Passport Guna Pelacakan Covid-19,0
1050,Cara Tung Desem Memaknai Nilai-nilai Pancasila di Saat Pandemi,0
1051,Jubir Pemerintah: Yakinlah Kita Bisa Lewati Pandemik COVID-19,0
1052,Awas Hoaks! - Formulir Online Palsu Pengajuan Banpres Produktif Usaha Mikro,1
1053,Tetap Optimis Berinvestasi Pada Masa Adaptasi Kebiasaan Baru,0
1054,Tuturial Mendapat Kuota Gratis 20GB dari Program Covid-19,1
1055,Pasien Sembuh Mencapai 180.797 Kasus,0
1056,Jokowi Keluarkan Kartu Corona Indonesia Sehat (KARCIS),1
1057,Lowongan Sukarelawan Covid-19 RSUD Dr. Soetomo Surabaya,1
1058,Infografis COVID-19 (4 Mei 2020),0
1059,Presiden Minta Daerah Tak Paksakan Adaptasi Kebiasaan Baru tanpa Perhatikan Data Sains,0
1060,Karna Mati Kena Corona,1
1061,Istora Senayan Dijadikan Tempat Penampungan Pasien Covid-19,1
1062,"Memasuki Masa Transisi Sulsel, Pemerintah Daerah Terus Ajak Masyarakat Adaptasi Kebiasaan Baru",0
1063,"Breaking News! Pilkada Serentak Ditunda, Kecuali Solo dan Medan",1
1064,"Penemuan Obat COVID-19, Ali Gufron: Membutuhkan Proses Panjang",0
1065,Akun Palsu Bupati Pasuruan Minta Penggalangan Dana Covid-19,1
1066,3M dan 3T Untuk Putus Penularan COVID-19,0
1067,Protokol Kesehatan Jadi Kebutuhan Masyarakat,0
1068,"Produktif di Rumah Selama Pandemi, Fabian : Coba dengan Memasak Makanan Bergizi",0
1069,Pemerintah Tetapkan Batas Tertinggi Biaya Pemeriksaan Swab Mandiri Rp. 900.000,0
1070,Riset Tunjukkan Masyarakat Indonesia Optimistis Sanggup Hadapi COVID-19,0
1071,Kandungan Alumunium pada Vaksin Berbahaya bagi Otak,1
1072,Kemendagri Minta Pemda Prioritaskan Anggaran Darurat Covid-19 Sesuai Peraturan,0
1073,Ka.Camat se DKI Jakarta menghimbau untuk menunda setiap rencana kegiatan yg mengumpulnya massa,1
1074,Foto Italia. Tidak Ada Lagi Ruang yang Tersedia di Rumah Sakit. #CoronavirusLockdown,1
1075,Jokowi Kejang dan Meninggal Dunia setelah Disuntik Vaksin,1
1076,Lima Hotel Isolasi Mandiri di DKI Jakarta Merawat 574 Pasien OTG,0
1077,"Virus ini punya obat Hydroxychloroquine, Zinc dan Zithromax",1
1078,Vaksin Polio Produksi Bio Farma Jadi Vaksin Pertama di Dunia Yang Masuk EUL dari WHO,0
1079,Infografis COVID-19 (11 Juli 2020),0
1080,Ketua Satgas Doni Monardo Daftar Relawan Vaksin COVID-19,0
1081,"Seberangi Samudra, Vaksin Dilindungi Peti Kemas Khusus",0
1082,Pasien Sembuh Covid-19 Sudah Menembus Angka 402.347 Orang,0
1083,Cerita Dokter Relawan di Garda Terdepan Penanganan COVID-19,0
1084,Flat Isolasi Mandiri Terisi 1.807 OTG dan Hotel Isolasi Mandiri DKI 437 OTG,0
1085,Kemenhub: Nekat Mudik Akan Diminta Putar Balik,0
1086,Satgas Covid-19: Zona Risiko Sedang Bukan Zona Nyaman,0
1087,Ahli Gizi: Pasien COVID-19 Konsumsi Protein dan Energi Lebih Tinggi,0
1088,Tahapan Pengembangan Obat dan Vaksin Mulai Uji Klinik Hingga Registrasi,0
1089,[BERITA] Perkembangan Chloroquine Untuk Obat COVID-19,1
1090,Presiden: Siapkan Terobosan Baru untuk Percepat Penanganan Pandemi,0
1091,"Kasus COVID-19 Sudah Tembus 40 Ribu Lebih, Pasien Sembuh Menjadi 15.703",0
1092,"Waspada DBD di Masa Pandemi, Lakukan Pencegahan Ini",0
1093,Bersihkan Diri Ketika Pulang Ke Rumah,0
1094,"Badan POM Kawal Aspek Mutu, Keamanan dan Khasiat Vaksin COVID-19",0
1095,Pemerintah Daerah Harus Gencarkan 3T Guna Tekan Covid-19,0
1096,MPR: Info Penanggulangan COVID-19 Agar Satu Suara,0
1097,Infografis COVID-19 (19 April 2020),0
1098,Mengapa Vaksinasi COVID-19 Diperlukan?,0
1099,Kesembuhan COVID-19 di Indonesia Tembus 100.000,0
1100,Daftar Zona Merah Daerah Terjangkit Virus Corona oleh TNI,1
1101,Tujuan Program Vaksinasi Tercapainya Herd Immunity,0
1102,Infografis COVID-19 (1 Oktober 2020),0
