,text,hoax
1103,Wapres: Ikhlaskan Saja Dana Haji Dipakai Pemerintah Agar Kalian Masuk Surga,1
1104,Infografis COVID-19 (02 Agustus 2020),0
1105,Pesan Berantai Kantor Pusat PT Kawan Lama Ditutup Karena Salah Satu Direksi Meninggal dan 10 Orang Karyawan Terpapar Covid-19,1
1106,Test Swab COVID-19 dapat Menyebabkan Lapisan Otak Pecah dan Pendarahan Hingga Kematian dan Pernah Terjadi di Kanada,1
1107,Satgas di Daerah Jadi Kunci Penanganan Covid-19 Berjalan Baik,0
1108,712 Pasien Masih Jalani Rawat Inap di RS Darurat Wisma Atlet,0
1109,Pemerintah Daerah Harus Screening Para Pelaku Perjalanan,0
1110,Infografis COVID-19 (1 Agustus 2020),0
1111,Baru sehari mentrinya jd TSK bantuan covid.19 yg ditilep. Hari ini kantor kemensos terbakar,1
1112,Indonesia Siap Produksi Baju APD 17 juta Unit Per Bulan,0
1113,Jembatan Suramadu Bebas dari Aktivitas Orang dan Kendaraan (Ditutup),1
1114,Pasien Sembuh Bertambah Menjadi 521.984 Orang,0
1115,"Mayjen TNI Dr. dr. Tugas Ratmono, Sp.S, M.A.R.S., M.H.: Perang di Masa Pandemi Sampai Lupa Hari",0
1116,Laser dari termometer gun akan merusak struktur otak,1
1117,Satgas COVID-19: Daerah Yang Tidak Masuk Zona Merah Bukan Berarti Aman,0
1118,Video Penampakan Kuntilanak di Rumah Sakit Galang Batam,1
1119,Panduan Pelaksanaan Salat Idul Adha di Masa Adaptasi Kebiasaan Baru,0
1120,Artikel Detik.com Trans Studio Bandung Tutup Mulai Hari ini Untuk Cegah Penyebaran Virus Corona di Bandung,1
1121,Kasus Aktif di 319 Kabupaten/Kota Dibawah 50 kasus,0
1122,"Maskerku Melindungi Kamu, Maskermu Melindungi Aku",0
1123,#CariTauVaksin: Mengapa Vaksin Penting?,0
1124,"Hindari COVID-19, Gaya Hidup Sehat bagi Obesitas",0
1125,"[Update] – COVID-19 Sabtu: 1.155 Positif, 59 Sembuh, dan 102 Meninggal",0
1126,Tower 9 Flat Karantina Mandiri Turun 556 Pasien,0
1127,Informasi Keliru Soal COVID-19 Hanya Menambah Beban Psikologis,0
1128,"Disiplin Protokol Kesehatan, Upaya Menekan Peningkatan Kasus Aktif",0
1129,Pasien Sembuh Harian Bertambah Lebih Banyak Dari Pasien Terkonfirmasi Positif,0
1130,"Dana Bantuan PCPEN Telah Terealisasikan Rp423,23 Triliun",0
1131,Presiden Jokowi: Pemerintah Ingin Masyarakat Produktif dan Aman dari COVID-19,0
1132,Video Nasehat dari alm. Erma Yunita Simamora yg Meninggal pd Tanggal. 20-04-2020 di RS AR Bunda Lbk Linggau,1
1133,Infografis COVID-19 (10 Juli 2020),0
1134,Cerita Stand Up Komedian Tetap Kreatif dan Peduli di Tengah Pandemi COVID-19,0
1135,Video Jokowi Tidak Tahu Penyebab Kasus Corona Tembus 111 Ribu,1
1136,Awas Hoaks! Informasi Grup WhatsApp untuk Wilayah COVID-19 dan Pembagian Vaksin,0
1137,Memahami Data Kasus COVID-19 Lewat Laju Insidensi,0
1138,Inalilahi wainailaihi rojiun Telah meninggal..HRS..Di dalam sel karna kena covid…,1
1139,Gubernur Khofifah Ajak Bersilaturrahmi Idul Fitri Secara Online,0
1140,[FALSE] “Italy Announces Its Surrender”,1
1141,"Penambahan Kasus Positif Capai 2.657, Yuri: Klaster Baru Sudah Ditangani Secara Profesional",0
1142,"Bertambah 3.931, Pasien Sembuh Menjadi 349.497 Orang",0
1143,Istana Kepresidenan Terapkan Adaptasi Kebiasaan Baru,0
1144,"Himbauan Penutupan TPU Akibat Virus Corona, Jenazah Diminta Diletakkan Terlebih Dahulu di Rumah",1
1145,Pemerintah Pastikan Persediaan Bahan Pokok Aman dan Tersedia Selama Darurat Covid-19,0
1146,Penggunaan Masker Jadi Kunci Pencegahan Penularan COVID-19 Melalui Udara Pada Ruang Tertutup,0
1147,RS Lapangan Jatim Rawat 16 Pasien COVID,0
1148,Situs Formulir Online BANPRES oleh Kementrian Koperasi dan UKM,1
1149,BPPT Wujudkan Lima Produk Alkes Buatan Lokal untuk Penanganan COVID-19,0
1150,Video Kembang api Olimpiade ditampilkan pada saat ini karena Olimpiade Tokyo ditunda karena covid-19,1
1151,Pembukaan Sembilan Sektor Ekonomi Utamakan Aspek Kesehatan,0
1152,"Warga Bisa Gunakan Masker Kain Cegah Antisipasi COVID-19, Asal Jaga Jarak",0
1153,Memakai Masker Dapat Timbulkan Radang Selaput Dada,1
1154,"Soal Warning CDC Amerika, Prof Wiku: Semua Negara Pasti Melindungi Warganya",0
1155,Infografis COVID-19 (16 Juli 2020),0
1156,Relawan: Vaksin dan 3M Percepat Pemulihan Kehidupan,0
1157,Arahan Presiden Soal Manajemen Penanganan Pasien Hingga ‘RS Tanpa Dinding’,0
1158,Kemenkes Bagikan 1 Juta Masker,0
1159,Vaksin Covid-19 Menjadi Salah Satu Prioritas Utama Pemerintah Menangani Pandemi di Tahun 2021,0
1160,"Pasien Sembuh COVID-19 Bertambah 243 Orang, Total 2.197",0
1161,Vaksin COVID-19 Tidak Perlu Dikhawatirkan Masyarakat,0
1162,"Sudah Mau Dimulai Lockdown per Wilayah, Lockdown di Bali Tanggal 25 Maret 2020",1
1163,3 Hari ke Depan Arus Angin dari Utara ke Arah Selatan yg Membawa Wabah (Penyakit) akan Melewati Indonesia Menuju Australian,1
1164,Gugus Tugas Distribusikan Alat PCR Deteksi COVID–19 ke 12 Provinsi,0
1165,Presiden Instruksikan Sejumlah Langkah Penanganan COVID-19 di Jawa Timur,0
1166,Kawasan Johor Baru Malaysia Terdampak Ekonomi Pandemi Covid-19,1
1167,Satu Visi dan Strategi Tangani COVID-19,0
1168,Kesadaran Masyarakat dan Kontrol Pemerintah Daerah Jadi Kunci Penanganan COVID-19 di NTT,0
1169,"[FALSE] “Italy Arrest Doctor for Intentionally Killing Over 3,000 Coronavirus Patients”",1
1170,Masyarakat Perlu Membuat Zonasi di Rumah Masing-Masing,0
1171,Artikel CNN Seorang Dokter Merekomendasikan Vaksin Covid19 Disuntikkan di Alat Kelamin Pria,1
1172,Kiat Bagi Orang Tua Buat Anak Betah Saat #Dirumahaja,0
1173,Mulai Senin 30 Maret Kota Makassar Lockdown Lokal untuk Mencegah Penyebaran COVID-19,1
1174,Satgas Minta Dilakukan Evaluasi Menyeluruh Bagi 54 Daerah Zona Oranye,0
1175,[FALSE] The “pray for italy” Video,1
1176,Pusat Panggilan 119 dan Laman Resmi PDSKJI Kini Bisa Layani Konsultasi Kesehatan Jiwa,0
1177,"Perkembangan COVID-19 Juni, Dr. Dewi: Angka Positivity Rate Lebih Rendah daripada Bulan Mei",0
1178,Surat Edaran MUI tentang Rapid Test bagi Para Tokoh Agama Islam,1
1179,"Cegah COVID-19, Polri Tutup Pintu Masuk Arus Balik Menuju Jakarta",0
1180,Pasien Sembuh dari COVID-19 Berjumlah 378.982 Orang,0
1181,Infografis COVID-19 (23 September 2020),0
1182,"Kebiasaan Anyar, Jadi Jurus Banyuwangi Atasi COVID-19",0
1183,"Airin: Ada Pemotor Sudah Pakai Masker untuk Cegah COVID-19, Tapi Helm Lupa",0
1184,Bersabar dan Peduli Saat Hadapi COVID-19,0
1185,Kemenristek BRIN Bentuk Konsorsium Riset Teknologi Penanganan COVID-19,0
1186,Pasien Sembuh Mencapai 199.403 Kasus,0
1187,Jubir COVID: Lima Minggu Terakhir DKI Zona Merah,0
1188,"Jokowi: Sengaja Saya Bedakan Mudik & Pulang Kampung, untuk Mengelabui Virus Corona",1
1189,Presiden: Dukung Penuh Riset dan Inovasi Terkait Penanganan COVID-19,0
1190,Surat Edaran MUI Waspada Rapid Test Modus Operandi dari PKI,1
1191,"Kasus OTG Terkonfirmasi Positif COVID-19 di Jatim Naik, Khofifah Minta Warga Jangan Mudik",0
1192,440.000 Tenaga Kesehatan dan 23.000 Vaksinator Disiapkan untuk Pelaksanaan Vaksinasi,0
1193,Indonesia Siap Produksi Ventilator Lokal Tangani Pasien COVID-19,0
1194,Pendaftaran Relawan COVID-19 di Wisma Atlet,1
1195,Flat Isolasi Mandiri Turun 151 OTG dan Hotel Isolasi Mandiri DKI 422 Pasien,0
1196,Tim Percepatan Penanganan Vaksin COVID-19 Sinergikan Seluruh Lembaga Penelitian,0
1197,Pelabuhan Merak-Bakauheni Tutup Pasca Persebaran Virus Corona,1
1198,mulai tanggal 31-12-2020 pukul 06.00 sore sampai dengan tanggal 01-01-2021 akan dilakukan mati lampu total,1
1199,Kemenhub Terbitkan Peraturan Menteri tentang Pengendalian Transportasi Cegah Penyebaran COVID-19,0
1200,Olahraga Jadi Benteng Setelah Protokol Kesehatan,0
1201,"Buntut Penerapan PSBB di Palembang, Batas Operasional Akses Hingga Pukul 14.00",1
1202,Infografis COVID-19 (13 Agustus 2020),0
1203,"Bertambah 1.355, Total Kesembuhan 94.458 Kasus",0
1204,Infografis COVID-19 (4 November 2020),0
1205,"Pemerintah Kucurkan Rp405,1 Triliun untuk Tangani Dampak COVID-19",0
1206,Tidak Bepergian Menjadi Kunci Pemutus Rantai Penularan COVID-19,0
1207,Ketua Gugus Tugas Genjot Upaya Penanganan COVID-19 di Jatim,0
1208,"Vaksin COVID-19 GRATIS, Tanpa syarat!",0
1209,Tingkat Kesembuhan COVID-19 Membaik Pada 399 Kabupaten/Kota,0
1210,Video Di India Lockdown Buntutnya Rusuh,1
1211,"Zona Merah Meningkat, Satgas Minta Daerah Untuk Evaluasi Kebijakan Penanganan",0
1212,Edukasi Berbasis Keluarga Tularkan Kebiasaan Baru Cegah COVID-19,0
1213,Pendataan Imunisasi COVID-19 untuk Tenaga Medis dan Non Medis oleh Dinas Kesehatan Provinsi DKI Jakarta,1
1214,Infografis COVID-19 (30 Juli 2020),0
1215,"Perubahan Dinamika Zonasi Risiko COVID-19, Pemda Wajib Pantau Pelaksanaan Protokol Kesehatan",0
1216,Liga Indonesia Bergulir Kembali dengan Penerapan Protokol Kesehatan,0
1217,Menteri Basuki : 4 Tower Wisma Atlet Kemayoran Siap Digunakan Sebagai RS Darurat Penanganan COVID-19 Beranda »,0
1218,"Info valid dari org dlm Istana: LBP siap2 utk melarikan diri ke luar negeri, kemungkinan ke Cina",1
1219,Obat Covid-19 dari Asap Batok Kelapa,1
1220,"Cara Ampuh Lawan COVID-19: 3M, 3T, Vaksin",0
1221,"Rasa Aman, Sehat dan Nyaman Kunci Bangkitkan Pariwisata di Tengah Pandemi COVID-19",0
1222,"PEMERINTAH PUTUSKAN MELARANG MUDIK, KEMENHUB SIAPKAN PERMENHUB",0
1223,MPR Pahami Antisipasi Defisit Anggaran Lima Persen,0
1224,Prosedur Kepulangan Pekerja Migran di Tengah Pandemi COVID – 19,0
1225,Infografis COVID-19 (27 April 2020),0
1226,Analisis Data COVID-19 Indonesia (Update Per 11 Oktober 2020),0
1227,"Vaksin COVID-19 Belum Ditemukan, Lindungi Diri dengan Lakukan Protokol Kesehatan",0
1228,Pelaksanaan Wisuda UIN Imam Bonjol Padang Angkatan 83 dan 84 Tahun 2020,1
1229,Disiplin Jalankan Protokol Kesehatan Kunci Hindari Gelombang Kedua,0
1230,"Konsumsi Sayur dan Ikan Segar, Yuk Simak Panen Warga Pesanggrahan",0
1231,Transparansi dan Keterbukaan Informasi Melalui Sistem Bersatu Lawan COVID,0
1232,HOAKS ➡️ Vaksin COVID-19 Dapat Mengubah DNA Manusia ⬅️,0
1233,China Akui Dokter Palestina Penemu Vaksin Corona yang Terbukti Ampuh 100 Persen,1
1234,Bio Farma Siapkan Vaksin COVID-19 dari Sinovac,0
1235,Proses Uji Klinis Vaksin COVID-19 Tahap Tiga: Belum Ada Laporan Negatif,0
1236,Infografis COVID-19 (25 Oktober 2020),0
1237,"Jumlah Sembuh COVID-19 Bertambah Menjadi 607, Jauhi Angka Kematian 520",0
1238,"Data Sains, Dasar Pengambilan Kebijakan Penanganan COVID-19",0
1239,"Kunjungan Kerja ke Ambon, Doni Monardo Titip Pesan Kearifan Lokal dan Serahkan Bantuan untuk Tangani COVID-19",0
1240,Cina mentargetkan 100 jt penduduk indonesia mati melalui vaksin cina,1
1241,Tulisan dr. Siti Fadillah terkait Pengobatan Covid-19,1
1242,"Di Italia, ketika gereja dibuka kembali, hampir semua jemaatnya sudah meninggal karena COVID",1
1243,Pemerintah Pastikan Data Penerima Vaksin COVID-19 Aman,0
1244,Pasien Sembuh Menembus Angka 255.027 Kasus,0
1245,Kepatuhan Protokol Kesehatan menjadi Kunci Pulihnya Kondisi Perekonomian,0
1246,"Paket Bantuan Sosial Mulai Disalurkan bagi 1,2 Juta Keluarga Penerima Manfaat di DKI Jakarta",0
1247,Jurus Pondok Pesantren Darunnajah Tekan COVID-19,0
1248,Ternyata ini tujuan masuk mall pakai barcode,1
1249,Jawa Timur Jadi Penyumbang Kesembuhan COVID-19 Terbanyak Hari Ini,0
1250,Video Obat COVID-19 Telah Ditemukan dan Siap Disebarkan ke Seluruh Indonesia,1
1251,Waspada Ancaman Demam Berdarah di Masa Pandemi,0
1252,Tangkapan Layar Pengakuan Relawan Suntik Vaksin Covid-19 yang Menyebut Lupa Punya Hutang tapi Plonga-Plongo,1
1253,Video Konvoi Kemenangan Plat AD Tidak Patuhi Protokol Kesehatan,1
1254,Menaruh Amoxilin Dalam Tandon Air Dapat Menangkal Covid-19,1
1255,Gugus Tugas: Rasio Tes Indonesia Tidak Bisa Serta Merta Dibandingkan dengan Negara Lain,0
1256,Pesan Sukarelawan untuk Masyarakat Taati Protokol Penanganan COVID-19,0
1257,Arahan Presiden kepada Gubernur Soal Penanganan Covid-19,0
1258,Gubernur Jakarta Anies Baswedan mendapat penghargaan terbaik di seluruh dunia dalam penanganan COVID-19,1
1259,Penuhi Hak Imunisasi Anak Sekalipun Pandemi,0
1260,Infografis COVID-19 (26 Juli 2020),0
1261,Ibu Rumah Tangga dan Organisasi Perempuan Ujung Tombak Tekan Penularan Dalam Klaster Keluarga,0
1262,Peran Multipihak Bagian dari Pentaheliks Penanganan Pandemik COVID –19,0
1263,"Hari Kedua Lebaran, Pasien Sembuh Bertambah 240 Orang, Total Jadi 5.642",0
1264,Kenyamanan Wisatawan dengan Penerapan Protokol Kesehatan,0
1265,Vaksin COVID-19 Buatan Sinovac hanya untuk Uji Klinik dan Mengandung Sel Vero dan Bahan Berbahaya,0
1266,Surat Seruan Siaga 1 Majelis Ulama Indonesia,1
1267,Saring sebelum Sharing Informasi Melalui Ruang Digital Lawan COVID-19,0
1268,"Gibran: Kata Bapak Jadi Pemimpin Itu Tidak Perlu Pintar, Makanya Saya Akan Mencanlonkan Diri Menjadi Walikota",1
1269,Kebijakan PSBB Pilihan Paling Rasional di Tengah COVID-19,0
1270,Satgas Bentuk Tim Khusus Monitoring Dokter Terinfeksi COVID-19,0
1271,Pasien Sembuh dari COVID-19 Mencapai 177.327 Kasus,0
1272,Pemerintah Siapkan Sistem Informasi dan Satu Data Pelaksanaan Vaksinasi COVID-19,0
1273,Satgas Minta Tokoh Muda Ajak Kaum Milenial Sukseskan Vaksinasi,0
1274,"Meragukan Keberadaan COVID-19, Aa Gym : ""Menzolimi Diri dan Orang Lain""",0
1275,Pemerintah Indonesia Siapkan 10 Ribu Tempat Tidur di 1000 RS Khusus Pasien COVID-19,0
1276,"Kasihi Orang di Sekitar Kita, Ikuti Protokol Kesehatan",0
1277,Video Rusia Jadi Pemenang Pembuatan Vaksin C19,1
1278,Apa Itu Vaksin?,0
1279,Satgas Covid-19 Sebut Pentingnya Komunikasi Terstruktur Dalam Program Vaksinasi,0
1280,Vaksinasi Gratis Percepat Kekebalan Komunitas,0
1281,Pasien Sembuh Dari COVID-19 Menjadi 353.282,0
1282,Butuh Tenaga Sarjana Kesehatan Masyarakat untuk Relawan Tracing,0
1283,"Cegah Penyebaran Covid-19, Kemendikbud Dorong Pemda Terapkan PPDB 2020 Secara Daring",0
1284,Infografis COVID-19 (06 Juli 2020),0
1285,Video rumah sakit terkenal di Brazil kosong padahal katanya ada 5000 orang yang positif corona,1
1286,Presiden Ingatkan Daerah untuk Terus Kendalikan Penyebaran Covid-19,0
1287,Rakyat Italia Buang Duit ke Jalan karena Sudah Tidak Berguna Akibat Virus COVID-19,1
1288,Perkembangan Terkini Penelitian Regimen Kombinasi Obat dan Stem Cell Efektif untuk Pengobatan COVID-19 Berbasis Isolat Virus Indonesia,0
1289,"Pasien Sembuh COVID-19 Bertambah 231 Orang, Kasus Meninggal 15",0
1290,Menkes Tetapkan PSBB 5 Wilayah di Jabar,0
1291,Skema Pemberian Bantuan untuk Masyarakat Terdampak Pandemi COVID-19,0
1292,Upaya BP2MI Jamin Kepulangan Pekerja Migran Indonesia ke Kampung Halaman,0
1293,Pemerintah Pusat Minta Pemda Realokasi Dana untuk Darurat Covid-19,0
1294,"Bukannya memotong gajinya untuk mereka para tim medis, malah memotong tunjangan para tim medis.",1
1295,Donasi Kaos Oblong Bekas Untuk Tim Medis RSD Wisma Atlet,1
1296,"Vaksinasi : Hentikan Penularan, Pulihkan Kesehatan, dan Bangkitkan Ekonomi",0
1297,Satgas Ingatkan Pemda Untuk Tingkatkan Kualitas Penanganan COVID-19,0
1298,"Pencegahan, Penanganan COVID-19 di Desa Andalkan Relawan",0
1299,"Kasus Positif COVID-19 Naik 700, Pasien Sembuh 293, Meninggal 40",0
1300,Satgas COVID Sebut Upaya Menekan Persebaran COVID Buahkan Hasil,0
1301,"Kota Prabumulih, Kota Tanpa Corona",1
1302,Risma Joget Tanpa Menggunakan Masker,1
1303,Infografis COVID-19 (13 Juni 2020),0
1304,"7.582 Orang Sembuh, Kesembuhan Harian Capai Angka Tertinggi",0
1305,APD dari China Dibeli dengan Uang Pribadi Prabowo,1
1306,Pasien Sembuh Capai Angka 174.350 Kasus,0
1307,Akun Facebook Bupati Bekasi Meminta Sumbangan Dana Covid-19,1
1308,Pembelajaran Tatap Muka Harus Utamakan Keselamatan Siswa-Siswi,0
1309,Gugus Tugas Berlakukan Rapid Test Massal Identifikasi Penyebaran COVID-19,0
1310,Kemenag Terbitkan KMA Keringanan UKT Mahasiswa PTKN,0
1311,: Link Untuk Mengecek Daftar KK Penerima Bansos Rp300 Ribu DKI Jakarta Per Januari 2021,1
1312,Dilarang Berdekatan dan Dilarang Berkumpul,0
1313,Ketua Gugus Tugas Restui Pembukaan Pariwisata Bersyarat di Tengah Pandemi COVID-19,0
1314,"Iman, Aman dan Imun Solusi Komprehensif Terhindar Covid-19",0
1315,"Insentif Virus Corona, Pemerintah Gratiskan Akses Internet",1
1316,"Bertambah 1.615, Kesembuhan Total 65.907 Kasus",0
1317,Pesan Berantai Tautan Subsidi Kuota Belajar Gelombang Pertama 2021,1
1318,Tips Kesehatan Jiwa Menghadapi Situasi Dampak Pandemi COVID-19,0
1319,Gambar Pengujian Vaksin Covid-19 Telah Sukses,1
1320,Infografis COVID-19 (28 Juni 2020),0
1321,"Donald Trump: Darahku adalah vaksinnya!!!,",1
1322,Pasien Sembuh Terus Meningkat Mencapai 184.298 Kasus,0
1323,Satgas Pastikan Ketersediaan Almatkes dan Vaksin Di Daerah Tercukupi,0
1324,Upaya Pencegahan Penyebaran COVID-19 di Lingkungan Pendidikan Pondok Pesantren,0
1325,Sultan HB X Sebut Positif-Negatif Covid-19 Sama Saja Karena Semua Orang Pasti Meninggal,1
1326,Vaksinasi Sukses Jika Didukung 3M,0
1327,Kemajuan Teknologi Meningkatkan Penemuan Vaksin Lebih Cepat,0
1328,Polri Ungkap Angka Kejahatan Menurun Selama Pandemik COVID–19,0
1329,Lima Provinsi Tercatat Tangani Kasus COVID-19 dengan Baik,0
1330,Jumlah Pasien Sembuh Meningkat Menjadi 695.807 Orang,0
1331,Tetap Cek ke Dokter Saat Pandemi Bila Alami Masalah Kesehatan,0
1332,Kemendikbud Terbitkan Kurikulum Darurat pada Satuan Pendidikan dalam Kondisi Khusus,0
1333,Mahasiswa UNY Positif Corona,1
1334,Kreativitas Itu Murni Bakat atau Dapat Dilatih?,0
1335,Perangkat Desa Diminta Bentuk Relawan dan Pranata Baru Sebagai Antisipasi Respon Masyarakat Hadapi COVID-19,0
1336,Kiat Keberhasilan Relawan COVID-19 Dalam Membantu Sesama,0
1337,Bantuan Bagi Pendidik dan Tenaga Kependidikan Non PNS di Kemenag,0
1338,Pengurangan Mobilitas saat Libur Panjang Potensial Turunkan Kasus COVID-19,0
1339,Lomba Inovasi Daerah Jadi Sarana Edukasi Adaptasi Kebiasaan Baru,0
1340,"Sebanyak 75 Pasien COVID-19 Sembuh, Kasus Positif 1.414 dan 122 Meninggal",0
1341,Pentingnya Sinergi Komunitas Agama dan Ormas Dalam Penanganan Covid-19,0
1342,Paus Fransiskus Mengatakan Vaksin Covid Sekarang Akan Diperlukan Untuk Masuk Surga,1
1343,MUI: Sebaik-Baiknya Shalat Adalah Shalat yang Dilakukan di Rumah,0
1344,"Pasien Sembuh COVID-19 Naik Jadi 33.529, Kasus Positif Bertambah 1.611 dan Meninggal 52",0
1345,Indonesia: Orang Tua dan Pengasuh Mengupayakan Imunisasi Rutin yang Aman untuk Anak-anak Mereka Selama COVID-19,0
1346,"99, 9% Tingkat Kesembuhan Covid dan vaksin dengan tingkat efek merugikan 80%",1
1347,Presiden: Percepat Belanja Daerah untuk Dongkrak Ekonomi di Tengah Pandemi,0
1348,Prasyarat Perjalanan Cegah Kenaikan Kasus Paska Libur Panjang,0
1349,Infografis COVID-19 (17 April 2020),0
1350,Tidak Mudik untuk Cegah Penularan COVID-19,0
1351,China Lakukan Uji Coba Vaksin di Indonesia Karena Kekurangan Monyet,1
1352,Waspadai Penambahan Kasus Melalui Penularan di Tengah Masyarakat,0
1353,[FALSE] There has been Looting Everywhere for Fear of the Corona Virus”,1
1354,"Pidato Lengkap Jokowi, Negara Kita Tidak Pernah Berutang, Hanya melakukan Pinjaman Luar Negeri",1
1355,Program Mudik Sehat PSBB 2020 Oleh Big Bird,1
1356,Foto Pemerintah Jawa Timur sdh Menyiapkan 52 buah Tempat Kurantin bagi TKI yg Bru Pulang dari Luar Negri.,1
1357,Cerita Salat Jumat di Berbagai Negara Saat Pandemi,0
1358,"Pasien Sembuh Bertambah Menjadi 842, Kasus Positif COVID-19 Meluas ke 257 Kabupaten",0
1359,Pasien Berstatus Positif Covid-19 di Wilayah Tiban Melarikan Diri,1
1360,Gambar KORLAP: FPI Jika Gubernur butuh Bantuan KAMI KAMI akan kerahkan LASKAR Untuk mengusir & menangkap CORONA,1
1361,Cerita dan Peran Public Figure Perangi COVID-19,0
1362,Video cara pertolongan Emergency Covid 19,1
1363,Video Pemusik dan Penyanyi Dunia dari Berbagai Agama Menyanyikan Asmaul Husna di Selandia Baru untuk Memohon Berhentinya Wabah COVID-19,1
1364,Tuduhan Foto Interior Lab Darurat COVID-19 Labkesda DKI Hasil Mencomot,1
1365,Presiden Akan Tinjau Fasilitas Produksi dan Pelaksanaan Uji Klinis Vaksin COVID-19,0
1366,Sitkom Bajaj Bajuri Prediksi Corona 17 Tahun Lalu,1
1367,Tren Kesembuhan Mingguan Harus Terus Ditingkatkan,0
1368,Razia Masker Serentak Dengan Denda Rp250.000 di Wilayah Kabupaten dan Kota Bandung,1
1369,"Virus Corona Bukanlah Virus, Sinyal 5G yang Sebenarnya Membunuh Orang",1
1370,Upaya Kolektif Bersama Turunkan Risiko COVID-19 Tentukan Aktivitas Masyarakat,0
1371,Vaksin Melindungi Masa Depan Generasi Muda Indonesia,0
1372,"Kasus Sembuh COVID-19 Naik Jadi 1.391, 12 Provinsi Tidak Laporkan Penambahan Kasus Positif",0
1373,"Semangat Kartini Masa Kini, Peran Ganda Perempuan di Tengah Pandemik COVID–19",0
1374,Daerah Harus Pastikan Alat Kesehatan Tersedia Jelang Akhir Tahun,0
1375,"Kasus Sembuh COVID-19 Terus Naik Jadi 359, Sementara Positif 4.241",0
1376,Presiden Kembali Tekankan Pentingnya Strategi Intervensi Lokal dan Penggunaan Masker,0
1377,Video pembuangan jenazah-jenazah korban Covid-19 di laut Meksiko,1
1378,Vaksin Covid-19 berbasis mRNA Dapat Mengubah DNA Manusia,1
1379,Pesan Berantai BUBARNYA AGAMA By Ahmad Mustofa Bisri,1
1380,Video BLACK MARKET *ITALIA SUDAH MENYERAH*,1
1381,Lima Tahapan Menuju Masyarakat Aman COVID-19 dan Produktif,0
1382,Ketua Satgas Nasional Serahkan Bantuan Alat Kesehatan Penanganan COVID-19,0
1383,RS Darurat COVID-19 dan Flat Isolasi Mandiri Terisi 4.059 Pasien,0
1384,Presiden: Segera Realisasikan Belanja APBD untuk Dongkrak Ekonomi di Kuartal III,0
1385,Satgas Covid-19 Minta Provinsi dengan Kasus Tertinggi Lakukan Evaluasi 3T,0
1386,"Amati Kebiasaan Konsumen, Sesuaikan Cara Jualannya",0
1387,Kopi Bisa Cegah dan Sembuhkan Covid-19,1
1388,"Tangani Pandemi, Presiden: Fokus Nomor Satu Kita Tetap Kesehatan",0
1389,Tangkapan Layar Berita RK Ajak ABU JANDA Jadi Relawan Uji Vaksin COVID-19 Buatan China,1
1390,Menggunakan Masker Sebabkan Infeksi Staph,1
1391,Pentingnya Membantu Masyarakat Disabilitas di Tengah Pandemi COVID-19,0
1392,"Video Didemo rakyat, KETUA WAKIL RAKYAT DAN EMAKNYA ngga berani mongol malah GOYANG CORONA",1
1393,Total Kesembuhan Secara Nasional dari COVID-19 Berjumlah 145.200,0
1394,"Hampir 80% Ruang Perawatan di Tower 5, 6, dan 7 Wisma Atlet Terisi",0
1395,"Kasus Positif COVID-19 Melesat Naik 1.241, Total 34.316",0
1396,Tidak Mudik Cara Bijak Lindungi Keluarga dari Keterpaparan COVID-19,0
1397,Dokter Reisa: Penggunaan Rapid Test Tidak Digunakan Untuk Kepentingan Diagnostik,0
1398,Gugas COVID-19 Telah Distribusikan 349 Ribu APD,0
1399,Kesembuhan Harian Pasien COVID-19 Capai 2.366,0
1400,Pasien Covid-19 di Cimahi Kabur Dari Rumah Sakit,1
1401,Artikel berjudul Gli Italiani Chiamano Anies Baswedan Troppo Stupido Come Il Governatore di Jakarta,1
1402,Infografis COVID-19 (8 April 2020),0
1403,Penambahan Pasien Sembuh Melebihi Pasien Terkonfirmasi Positif,0
1404,Total Pasien COVID-19 yang Sembuh Jadi 105.198 Kasus,0
1405,razia yang pakai masker scuba kena swab dan denda,1
1406,"Penambahan Kasus COVID-19 Sentuh Angka 993, Total Menjadi 30.514",0
1407,Infografis COVID-19 (29 Juli 2020),0
1408,Pasien Sembuh Dari COVID-19 Sudah Berjumlah 418.188 Orang,0
1409,"Muncul Cluster Baru, DKI Jakarta Giat Lakukan Surveilans",0
1410,Pemerintah Optimis Perbaikan Ekonomi Pada 2021,0
1411,Infografis COVID-19 (6 September 2020),0
1412,"Hasil Uji 123.572 Orang, Kasus Positif COVID-19 Hari Ini Bertambah 689",0
1413,Tiga Pendekatan Sumatera Barat Pertahankan Zona Hijau,0
1414,"Ancaman COVID-19 Belum Berakhir, Presiden: Tetap Disiplin Jalankan Protokol Kesehatan",0
1415,"Nih yang bikin Covid, si jagoan Wall Street (Rockefeller Foundation)",1
1416,Vaksin Covid-19 Buatan Pfizer Berbentuk Vape,1
1417,Kreativitas Dongkrak Penghasilan UMKM PRAKARDUS,0
1418,Wapres Ma’ruf Amin Imbau Umat Islam Sholat Tobat Agar Virus Corona Cepat Teratasi,1
1419,Kominfo Pastikan Aplikasi PeduliLindungi Aman Dari Peretas,0
1420,Ganja Mampu Menangkal COVID-19,1
1421,Pengeluaran Rokok Ekspedisi Tanggal 25 Maret 2020 Sampai 30 April 2020 Akan Ditarik Pihak Terkait Untuk Dimusnahkan,1
1422,"Kasus Terkonfirmasi Positif COVID-19 Bertambah 693, Total Sembuh 4.575 Orang",0
1423,Fatwa Majelis Ulama Indonesia Nomor : 02 Tahun 2021,0
1424,Vaksin Bermanfaat Besar Lindungi Masyarakat,0
1425,Pemulihan Ekonomi Melalui Bisnis Digital di Masa Adaptasi Kebiasaan Baru,0
1426,"Konser Berbagi Kasih untuk COVID-19, Terkumpul Dana 4 M Hingga Lelang Motor Listrik Tanda Tangan Jokowi",0
1427,Papua Mengalami Lonjakan Kesembuhan Harian Pasien COVID-19,0
1428,MUI: Pemanfaatan Zakat untuk Penanggulangan COVID-19 Diperbolehkan,0
1429,Jokowi Menggunakan Vaksin Buatan Eropa,1
1430,"Hadapi COVID-19, Gugus Tugas dan TikTok Bersatu Dukung Tenaga Kesehatan",0
1431,Perampokan di Jalan Tidar Surabaya,1
1432,RRI Hadirkan Guru ke Rumah untuk Anak-anak di Tengah Pandemi COVID-19,0
1433,Gerakan Cuci Tangan yang Masif dan Massal Putuskan Penularan COVID-19,0
1434,Kota Bogor dan Kabupaten Banyuwangi Lakukan Inovasi Agar Masyarakat Produktif dan Aman Selama Pandemi,0
1435,"Terapkan Protokol Kesehatan, Polisi Jaring 5,7 Juta Pelanggar",0
1436,"COVID-19 Mewabah, Doni Monardo Ingatkan Pentingnya Disiplin Kolektif",0
1437,Tiga Jenis Peralatan Uji Sampel COVID-19 Mulai Terdistribusi ke Daerah,0
1438,Jokowi hari ini tolak di suntik vaksin Covid-19 duluan,1
1439,Tingkat Kesembuhan COVID Indonesia di Atas Rata-Rata Dunia,0
1440,Satgas COVID-19: Penambahan Kasus Positif Harian Harus Menjadi Peringatan,0
1441,"Hadapi Dampak COVID-19, Presiden: Tidak Boleh Pesimistis, Hadapi dengan Kerja Keras",0
1442,"Kasus Positif COVID-19 Bertambah 973 Orang, Total menjadi 20.162",0
1443,Berpikir Positif dan Aksi Nyata Hadapi Kehidupan di Tengah Pandemi,0
1444,Foto Gereja Bergamo Italia Hari Ini…,1
1445,The Covid-19 National Task Force Informs the World Community about Pandemic Mitigation,0
1446,SPK Tender Pengadaan Barang di Masa Pandemi oleh BPPBJ,1
1447,Ketua Tim Peneliti Pfizer: Vaksin Covid-19 Dapat Menyebabkan Kemandulan bagi Perempuan,1
1448,Jubir Pemerintah: Makna Mudik Tidak Akan Didapatkan Bila Dikarantina,0
1449,Corona adalah hoaks,1
1450,Strategi Kearifan Lokal Saat Transisi Adaptasi Kebiasaan Baru,0
1451,Infografis COVID-19 (18 April 2020),0
1452,Inovasi Guru di Perbatasan Manfaatkan Radio Sebagai Media Belajar Mengajar,0
1453,Analisis Data COVID-19 Indonesia (Update Per 23 Agustus 2020),0
1454,Mengapa Vaksin Penting?,0
1455,Orang Dewasa Tetap Perlu Imunisasi,0
1456,Perkembangan Peta Zonasi Risiko Perlu Disikapi Serius,0
1457,Infografis COVID-19 (17 Juni 2020),0
1458,Optimisme Vaksin Pulihkan Ekonomi,0
