,text,hoax
1459,Membuka Akses Informasi Kepada Penyandang Tuli Melalui Layanan Bahasa Isyarat,0
1460,Listrik Gratis dan Diskon yang Diberikan Negara Dibiayai dengan Utang dari Bank Dunia Sebesar 5 Triliun,1
1461,"Ini ada ratusan nyawa dokter yang sudah menjadi korban, Pak Menkes bilang jangan dibesar-besarkan",1
1462,Untuk Mengalahkan Virus Korona Adalah Mengambil Lebih Banyak Makanan Alkali yang Berada di Atas Tingkat PH Virus,1
1463,Langkah Ganda Kemenristek/BRIN dalam Upaya Pengembangan Vaksin Covid-19 di Indonesia,0
1464,Foto pandemi flu 1918,1
1465,Tips Liburan Aman dari Penularan COVID-19,0
1466,Peran Ibu Perkuat Ekonomi Keluarga di Masa Pandemi,0
1467,Segera Hadir! Peta Jalan Vaksinasi Nasional,0
1468,Lindungi Sesama dari Penularan COVID-19 dengan Disiplin Pakai Masker,0
1469,Presiden Jokowi: Evaluasi dan Perbaiki Pelaksanaan PSBB,0
1470,Infografis COVID-19 (30 Oktober 2020),0
1471,Kementerian PUPR Lanjutkan Penyelesaian RS Akademi UGM Sebagai RS Rujukan COVID-19 di Yogyakarta,0
1472,"Pasien Sembuh Terus Tumbuh Menjadi 686, Kasus Positif COVID-19 Masih Masif",0
1473,"PSBB Jawa Barat, Angka Kasus COVID-19 Turun",0
1474,BIO FARMA Dipercaya untuk Produksi Vaksin COVID-19,0
1475,"""Alat Tempur"" Berbelanja di Pasar yang Aman COVID-19",0
1476,Relawan Minta Tokoh Masyarakat Jangan Abai Protokol Kesehatan,0
1477,Tetap Imunisasi Rutin sekalipun Pandemi,0
1478,Semua Pasien Positif Covid-19 di Padang Dinyatakan Sembuh,1
1479,Infografis COVID-19 (20 April 2020),0
1480,"Tidak Memakai Masker, Pengendara Motor dan Mobil Didenda Rp 5 Juta atau Kurungan Penjara Dua Minggu",1
1481,Satgas: Penggunaan Masker oleh 75 Persen Populasi Tekan Penyebaran COVID-19,0
1482,Warga Jakarta Saling Memberikan Semangat di Balkon Apartemen,1
1483,Posgagah Bantu Percepatan Penanganan COVID-19 Wilayah Jawa Timur,0
1484,"Kasus Positif COVID-19 Bertambah 954, Pasien Sembuh Jadi 18.735, Meninggal Naik 35 Orang",0
1485,Himbauan Dokter Bernard Mahfoudz,1
1486,Kesembuhan Kumulatif Mencapai 240.291 Kasus,0
1487,Voucher Dua Pizza Besar Domino’s Pizza Selama Masa Pandemi Corona,1
1488,Syarat Vaksin Gratis Jokowi: BPJS Kesehatan Anda Harus Aktif,1
1489,sakitnya apa di diagnosa nya covid,1
1490,Pemerintah Apresiasi Tenaga Medis Hingga Pengemudi Ojek Daring,0
1491,Pasien Sembuh Harian Bertambah Sebanyak 3.968 Orang,0
1492,"Pasien Sembuh Bertambah 2.552, Total Kesembuhan 155.010 Kasus",0
1493,Masyarakat Diajak Tetap Lakukan Investasi Dan Konsumsi,0
1494,Infografis COVID-19 (11 Juni 2020),0
1495,Laboratorium Covid-19 Minimal Berstandar Biosafety Level 2,0
1496,Disiplin Protokol Kesehatan Guna Antisipasi Second Wave Pandemi,0
1497,SMS Dikirim Serentak untuk Penerima Vaksin COVID-19 Tahap I,0
1498,"PILKADA JANGAN DITUNDA, PILPRES TUNDA 7 TAHUN LAGI",1
1499,"DI WUHAN CINA KETIKA TERJADI VIRUS CORONA RAKYAT BERBONDONG2 KE MESJID, DI INDON RAKYAT DILARANG KE MESJID",1
1500,Pasien Sembuh Dari COVID-19 Bertambah Menjadi 570.304 Orang,0
1501,"Kasus Positif COVID-19 Sentuh Angka 10.118, Pasien Sembuh Naik 1.522 Orang",0
1502,Kemendikbud: Kolaborasi Kunci Kesuksesan Kegiatan Belajar Mengajar dari Rumah,0
1503,Instruksi Gubernur Jateng tentang penilangan bagi yg tidak bermasker di muka umum Rp.150.000 menggunakan e-tilang Via apps PIKOBAR,1
1504,Bank Indonesia Donasikan Alat Kesehatan Penanganan COVID-19 Melalui Gugus Tugas Nasional,0
1505,Foto Peta Persebaran COVID-19 di Jakarta Berwarna Merah dan Hitam,1
1506,Motor Terbakar Di Yogyakarta Karena Hand Sanitizer,1
1507,"Corona Mereda, Luhut Mau Tentara Cina Segera Masuk Lagi ke Indonesia",1
1508,Cegah Klaster COVID-19 dengan Memahami Penyebarannya,0
1509,Yuri: Sebagian Besar Penambahan Kasus Positif COVID-19 Adalah OTG,0
1510,Begini Upaya Menristek BRIN Percepat Pengujian Terduga COVID-19 di Indonesia,0
1511,Apa Saja Kandungan Vaksin?,0
1512,"Pembebasan Bersyarat Narapidana, Presiden: Narapidana Koruptor Tidak Pernah Dibicarakan",0
1513,Bandung Kota Zona Hitam Corona,1
1514,"Pertarungan Sesungguhnya Menghadapi Pandemi COVID-19 Itu di Jalan, Tidak di Rumah Sakit",0
1515,Dukungan Satgas Penanganan Nasional Terhadap Penanganan COVID-19 Sumut,0
1516,Infografis COVID-19 (25 April 2020),0
1517,Dokter Reisa: Protokol Jaga Jarak Dapat Turunkan Risiko Penularan COVID-19 Hingga 85 Persen,0
1518,Pesan Berantai Adidas Berikan Masker,1
1519,Anies Baswedan Terpapar COVID-19 dan Dilarikan ke RS Royal Sunter,1
1520,Video Ribuan Jamaah Tanpa Masker Sambut Kedatangan Ustadz Abdul Somad di Tengah Pandemi Covid-19,1
1521,"[BERITA] 49 WN Tiongkok yang Masuk ke Sultra Ternyata Orang Baru, Bukan Pekerja Lama",1
1522,Ahli : Pembuatan Vaksin Diawasi Ketat untuk Memastikan Keamanannya,0
1523,Mendikbud: Semua Guru Honorer Berpeluang Menjadi P3K Tahun 2021,0
1524,Psikolog Dorong Orang Tua Terapkan GEMBIRA Hadapi COVID-19,0
1525,Kumpulan Mobil di Pool Grab Cinere karena Sopir Tidak Sanggup Bayar Kredit Saat Covid-19,1
1526,Menristek/Kepala BRIN Dorong Riset Pangan dan Nutrisi sebagai Solusi Penanganan Stunting di Tengah Pandemi COVID-19,0
1527,Pesan Pemimpin Agama Lindungi Diri Lindungi Sesama Selama Pandemi,0
1528,Disiplin dan Patuh Protokol Kesehatan Kunci Utama Menekan Penularan COVID-19 di Perkantoran,0
1529,"Ketika di vaksin, microchip yg sangat kecil dipasang tanpa terasa, New Dajjal siap membunuh 7.5 milyard manusia",1
1530,Pembuat APD Diharap Ikuti Kualifikasi dan Spesifikasi Bahan,0
1531,"Peran Strategis BPOM, Pastikan Vaksin COVID-19 Aman dan Efektif",0
1532,"Penambahan Kasus Positif COVID-19 Masih Terjadi, DKI Jakarta Tertinggi",0
1533,Satgas COVID-19: Menghalangi Petugas Kesehatan Memeriksa Akan Dijatuhi Sanksi,0
1534,"Video Polisi Menangkap Seorang Pria karena Mengikuti Ibadah Gereja di Idaho, Amerika Serikat",1
1535,Rakyat Aceh menolak vaksin covid19 karena menurut para ulama Aceh itu haram,1
1536,"Memperingati Hari Kemanusiaan Dunia di Masa Pandemi, Nelwan: Inilah Momentum Kita",0
1537,"Vaksin COVID-19 Gratis Tanpa Syarat, Badan POM Kawal Keamanan dan Efektivitasnya",0
1538,Protokol Kesehatan dan Vaksinasi Putus Mata Rantai Penularan COVID-19,0
1539,"Cegah Covid-19, Wapres Minta Semua Masyarakat Taati Imbauan Pemerintah",0
1540,Pasien COVID-19 di Wisma Atlet dan Rumah Sakit Daerah Menurun,0
1541,Masker Menjadi Peluang Usaha di Masa Pandemi COVID-19,0
1542,Pemerintah Alokasikan Anggaran Khusus untuk Vaksin COVID-19,0
1543,Indonesia Miliki Dua Opsi Pengembangan Vaksin COVID-19,0
1544,Pilkada 2020 Sumenep Siap Digelar,1
1545,Apakah Vaksin COVID-19 Hanya Untuk Peserta BPJS?,0
1546,Satgas COVID-19: Pengalaman Libur Panjang Sebelumnya Jadikan Pelajaran,0
1547,Hindari Menyentuh Barang dengan Tangan,0
1548,Zona Hitam Surabaya,1
1549,"Dana Rp66,5 Miliar Diterima Gugus Tugas untuk Tangani COVID-19",0
1550,Pemda Dituntut Fokus Tekan Kasus Agar Zona Risiko Membaik,0
1551,Pasien Sembuh Covid-19 Bertambah Mencapai 563.980 Orang,0
1552,Satgas Covid-19 Memastikan Masyarakat Memperoleh Informasi Transparan,0
1553,"Hibah Pariwisata Rp3,3 Triliun untuk 101 Daerah",0
1554,Satgas Covid-19: Penerapan PSBB Ketat Harus Memperhatikan Multisektor,0
1555,Kesembuhan Harian Kembali Melampaui Penambahan Kasus Positif Baru,0
1556,Luhut Perintahkan TNI-Polri Tangkap Pemda yang Tutup Bandara,1
1557,"DAHSYATNYA FITNAH CORONA, ketakutan para elit global akan kebangkitan umat Islam",1
1558,Infografis COVID-19 (23 Mei 2020),0
1559,Mayoritas Provinsi Prioritas Mengalami Penurunan Kasus Positif,0
1560,Lima Arahan Presiden terkait Penerapan Adaptasi Kebiasaan Baru,0
1561,Foto Bupati Gowa dengan Narasi Lockdown Tanggal 19-27 Desember,1
1562,Komitmen Diaspora Membantu Korban PHK dan Terdampak Corona,0
1563,Italia Tidak Bisa Mengontrol Virus dan Mengucapkan Selamat Tinggal kepada Dunia,1
1564,"Masuukk truusss silahkan masuukk, Orang mudik dilarang aseng bebas",1
1565,Perilaku Masyarakat Kunci Meningkatnya Kesembuhan Pasien COVID-19,0
1566,Analisis Data COVID-19 Indonesia (Update Per 30 Agustus 2020),0
1567,Risiko Kematian COVID-19 Dipengaruhi Usia Dan Riwayat Komorbid,0
1568,Seorang Pasien Dalam Pengawasan Covid-19 (PDP) Mengamuk di Pintu Rumah sakit Pamekasan Madura,1
1569,Tips Keuangan: Dana Darurat Itu Penting,0
1570,Tingkat Kesembuhan Pasien COVID-19 Tembus 80.952 Kasus,0
1571,Vaksin Terbukti Manjur Untuk Mencegah Penyakit Tertentu,0
1572,RS Darurat COVID-19 Wisma Atlet Bisa Operasikan Dua Tower Tambahan Sebagai Antisipasi Lonjakan Pasien,0
1573,Ketahui Pemulasaran Jenazah Covid-19 yang Benar dan Hindari Khawatir Berlebihan,0
1574,Antisipasi COVID-19 Memakai Masker dengan Benar,0
1575,Pasien Sembuh Semakin Bertambah Menjadi 718.696 Orang,0
1576,Kemenkes: Isolasi Diri Menjaga Jarak Fisik,0
1577,Distribusi Vaksin COVID-19 Direncanakan dengan Matang,0
1578,Yuri: Jumlah Pasien Sembuh COVID-19 Hari Ini Cukup Menggembirakan,0
1579,Satgas Kedepankan Edukasi Masyarakat Manfaat Vaksinasi,0
1580,menghilangkan virus adalah mengkonsumsi lebih banyak makanan dan minuman alkali diatas tingkat keasaman virus,1
1581,Peran Polri dan TNI Implementasikan Instruksi Presiden Nomor 6 Tahun 2020,0
1582,Tekan Kasus COVID-19 Menhub Ingatkan Operator Perketat Protokol Kesehatan,0
1583,Satgas Covid-19: Jaga Kondusifitas Sampai Pilkada Selesai,0
1584,Gugus Tugas Nasional Luncurkan Mesin Deteksi COVID-19,0
1585,Pengawasan Ketat Indonesia pada Pembuat Vaksin di Tiongkok,0
1586,Vaksin Sinovac Bukti Komitmen Pemerintah Atasi Covid-19,0
1587,"Dari 28 Jadi 458 Kasus, Kesembuhan dari COVID-19 di Malut Melonjak Tajam",0
1588,Kominfo Prediksi Bakal Terjadi Kenaikan Traffic Selular Saat Lebaran di Tengah Pandemi COVID-19,0
1589,"Terapkan PSBB Transisi Pra-AKB, Walkot Bogor Lapor ke Ketua Gugus Tugas Nasional",0
1590,Kisah Dokter yang Kekasihnya Positif Covid-19 di Italia,1
1591,Gugus Tugas Targetkan 78 Laboratorium Uji COVID-19,0
1592,MPR Ajak Masyarakat Disiplin Terapkan Lima Langkah Cegah COVID-19,0
1593,Infografis COVID-19 (2 September 2020),0
1594,Infografis COVID-19 (2 Juni 2020),0
1595,Pesan Berantai Sebuah peringatan !! Sekarang ada yang baru dan sedang terjadi. Orang datang dari pintu ke pintu dan membagikan masker,1
1596,Kemenkes: PSBB Batasi Kegiatan Tertentu di Wilayah Terduga COVID-19,0
1597,Infografis COVID-19 (7 Mei 2020),0
1598,Cara Vaksin Picu Kekebalan Tubuh,0
1599,Tahap I Banpres Produktif Usaha Mikro Capai Realisasi 100%,0
1600,Foto Tweet KPK : Anggota DPR Dites Corona Malah Positif Korupsi Anjing,1
1601,Jus Jahe dan Lada Hitam Mampu Sembuhkan Covid-19,1
1602,SITUBONDO LOCKDOWN,1
1603,Nasi Padang Menjadi Sumber Penularan Covid-19,1
1604,Akselerasi Vaksin COVID-19 Karya Anak Bangsa,0
1605,Bulog Jamin Stok Beras Jelang Idul Fitri di Tengah Pandemi COVID-19 Aman dan Tercukupi,0
1606,Infografis COVID-19 (7 Juni 2020),0
1607,Pemanfaatan Layanan Telemedik untuk Pencegahan dan Penanganan COVID – 19,0
1608,Infografis COVID-19 (5 Oktober 2020),0
1609,Infografis COVID-19 (5 Mei 2020),0
1610,"Tingkat Kesembuhan COVID-19 di Indonesia Menjadi 77,3%",0
1611,48 Orang di Korea Selatan Meninggal Setelah Disuntik Vaksin COVID-19,1
1612,Infografis COVID-19 (29 April 2020),0
1613,Masyarakat Perlu Memahami Upaya Penanganan COVID-19 Agar Tidak Tersesat Informasi,0
1614,Video Gara2 Corona Ada Orang Jatuh dari Motor Cuma Diliatin,1
1615,"COVID-19 Merupakan Buatan Manusia sebagai Senjata Biologis dari Carolina Utara, Amerika Serikat dan Pasien Nol Bernama Maatje Benassi",1
1616,Yuk Cek Fakta Seputar Mitos Vaksin,0
1617,"Doni Monardo Bersama Ketua MPR, Mengajak Masyarakat Gotong Royong dan Bersatu Melawan COVID-19",0
1618,Infografis COVID-19 (12 Mei 2020),0
1619,Menteri PPPA: 94 Perempuan-26 Anak Positif COVID-19,0
1620,Pemda Diminta Tingkatkan Penanganan Untuk Menurunkan Kasus Aktif,0
1621,Kemenag: Selama Ramadan Laksanakan Ibadah di Rumah,0
1622,"Update Penambahan Kasus COVID-19, Positif 1.624, Meninggal 53 dan Sembuh 1.072 Orang",0
1623,Jokowi Takut Datang ke Sidang PBB karena Pasukan Sniper Sudah Menunggu,1
1624,[Top 5] Topik Teratas Periksa Fakta MAFINDO Periode 14-20 Maret 2020,1
1625,"Vaksin Bermasalah dan Mengerikan, Disuntik Bisa Menjadi Sakit dan Sekarat",1
1626,"Yuri: Tenaga Kesehatan Bekerja Mati-Matian Tangani COVID-19, Mari Dukung Mereka dengan Mengubah Perilaku",0
1627,Baru Kemarin Pemerintah Putuskan Tak Larang Mudik Lebaran,1
1628,"Disiplin 3M, Hal Sederhana Yang Dapat Menyelamatkan Nyawa",0
1629,Strategi Sektor Sumber Daya Energi Hadapi Pandemi COVID-19 Berkepanjangan,0
1630,Alat Thermo Gun dapat Merusak Kelenjar Pineal,1
1631,Relawan Alami Gangguan Saraf Setelah Disuntik Vaksin Sinovac,1
1632,Satgas COVID-19: Liga Sepakbola Harus Pertimbangkan Status Zona Lokasi,0
1633,Infografis COVID-19 (10 September 2020),0
1634,Bimas Katolik Kemenag-Gereja Sepakati Tak Ada Kegiatan Kumpulkan Umat,0
1635,Pengendalian Moda Transportasi Cegah Penyebaran COVID – 19,0
1636,Angka Kesembuhan Kumulatif Terus Bertambah Menjadi 631.937 Orang,0
1637,Yuri: Masyarakat Belum Tertib Menerapkan Jaga Jarak Aman COVID-19 Saat CFD,0
1638,"Gara-Gara Virus Corona, TKA China Digaji 200 Juta Per Bulan",1
1639,Foto Penangkapan Direktur National Institute for Allergy and Infectious Diseases (NIAID),1
1640,Video Kisah pilu dari ITALY IBU nya meninggal pasien COVID-19,1
1641,"Cegah COVID-19, Masyarakat Dapat Memanfaatkan Layanan Telemedecine",0
1642,Jumlah Pasien Sembuh Dari COVID-19 Terus Bertambah Menjadi 329.778 Orang,0
1643,Rapid Test Di Bandara Soekarno-Hatta Bayar Rp550 Ribu,1
1644,Enam Penumpang Kapal di Pelabuhan Samudera Terduga Positif Corona,1
1645,Pasien Sembuh Harian Melampaui Penambahan Kasus Positif Baru,0
1646,Sebanyak 192 Orang Sembuh Covid-19 dan 2.491 Positif di Indonesia,0
1647,"Corona Sudah Masuk ke TB Telaga Bestari, Pramugari Lion Air Sdh Terinfeksi dan Saat Ini Dirawat di RS Annisa",1
1648,Jokowi Positif Corona,1
1649,Polri Tindak 18 Kasus Penyimpangan Produksi dan Distribusi APD,0
1650,Pemda di Zona Merah Harus Tingkatkan dan Masifkan 3T,0
1651,Satgas COVID-19 Tekankan Perilaku Disiplin Protokol Kesehatan Langkah Utama Atasi Pandemi,0
1652,Infografis COVID-19 (5 April 2020),0
1653,Perawat: Butuh Satu Jam Tangani Satu Pasien COVID-19,0
1654,Rotan Jadi Simbol Kedisiplinan dan Edukasi Protokol Kesehatan di Kota Ambon,0
1655,Infografis COVID-19 (24 Juli 2020),0
1656,"ISTANA : TIDAK ADA LOCKDOWN DAERAH, KEPALA DAERAH YANG MEMBUAT ATURAN SENDIRI, AKAN DIKENAKAN SANKSI",1
1657,Kriteria dan Syarat Perjalanan Orang Saat Adaptasi Kebiasaan Baru yang Aman dan Produktif,0
1658,Pembagian Masker Gratis Dicampur Bius,1
1659,Pasien Sembuh COVID-19 Naik Signifikan Menjadi 548 Orang,0
1660,Program Banpres Produktif Usaha Mikro Capai 100% dan Resmi Perluas Penerima Manfaat,0
1661,Satgas Covid-19: Pemerintah Kawal Akselerasi Vaksin Merah Putih,0
1662,Dwayne Johnson The Rock Bagikan Uang Bantuan Corona Kepada 10.000 Pengguna Facebook,1
1663,Rekomendasi Kementan dalam Kegiatan Kurban di Masa Pandemi COVID-19,0
1664,"Sebanyak 1,2 Juta Vaksin Coronavac Lulus Uji Sertifikasi Lot Release",0
1665,Satgas: Optimalkan Masa PPKM Untuk Tekan Laju Kasus,0
1666,Infografis COVID-19 (1 November 2020),0
1667,Lima Langkah Efektif di Pesantren dalam Mencegah COVID-19,0
1668,Indonesia Pastikan Pengadaan Vaksin COVID-19 Bagi 20% Populasi Berisiko,0
1669,Kebijakan Pembatasan Kegiatan Upaya Kendalikan Covid-19 di Pulau Jawa – Bali,0
1670,Selamatkan Lansia dan Komorbid dengan Patuh Protokol Kesehatan,0
1671,Kesembuhan COVID-19 di Jawa Tengah Meningkat Pesat,0
1672,Kunci Utama Menekan Penularan Adalah Perilaku Disiplin 3M,0
1673,"Positif Corona, Kondisi Donald Trump Kritis dalam 24 Jam Terakhir. Kok sama kayak di film The Simpson",1
1674,Tingkat Kesembuhan Pasien COVID-19 di Indonesia Naik,0
1675,Prioritas Pemerintah Menangani Pandemi Ialah Menjaga Keselamatan Rakyat,0
1676,Ketua Gugus Tugas Nasional Apresiasi Mobile Biosafety Level (BSL)-2 BPPT,0
1677,Infografis COVID-19 (11 September 2020),0
1678,"Penggunaan Thermal Gun Dapat Merusak Otak, Yuri: Itu Statement Tidak Benar",0
1679,Pasien Sembuh COVID-19 Jumlahnya Terus Meningkat Menjadi 429.807 Orang,0
1680,Infografis COVID-19 (26 April 2020),0
1681,Vaksinasi: Siap Divaksin Saat Vaksin Siap,0
1682,Aktor Javed Haider menjual sayuran karena tidak ada pekerjaan akibat pandemi #COVID19,1
1683,Satgas Covid-19: Target Penanganan Harus Capai 100 Persen Kesembuhan,0
1684,Indonesia Berpengalaman dan Siap Distribusi Vaksin Sampai ke Pelosok,0
1685,Bangga Alat Kesehatan Buatan Indonesia,0
1686,Kesembuhan Harian di Yogyakarta Meningkat,0
1687,Pasien Sembuh COVID-19 Melebihi Setengah Juta Orang,0
1688,Ketua Gugus Tugas Nasional Tinjau Kesiapan Hotel Grand Surabaya untuk Relaksasi Tenaga Kesehatan,0
1689,Haikal Hassan Dijemput Allah Petinggi FPI Berkurang Lagi,1
1690,Gugus Tugas Ingatkan Masyarakat Waspadai DBD Saat Pandemi COVID-19,0
1691,"Kesembuhan Mingguan Mengalami Kenaikan 14,1%",0
1692,"Penambahan Kasus COVID-19, Positif 1.681, Meninggal 71 dan Sembuh 919 Orang",0
1693,Sebanyak 103 Pasien Sembuh dan 1.677 Positif COVID-19 di Indonesia,0
1694,Surat Undangan Doa Bersama Mengatasnamakan Gubernur Jawa Timur,1
1695,"Golden Swalayan Jadi Klaster Baru Covid-19, Warga Wajib Lapor RT Jika Ingin Berkunjung",1
1696,Pemerintah Kaji Libur Panjang Akhir Tahun,0
1697,Yakinkan Anak COVID-19 Pasti Berlalu,0
1698,Penerima Bantuan Subsidi Upah Capai 90%,0
1699,Protokol Kesehatan Keluarga,0
1700,kesimpulan Rob Oswald: COVID 19 adalah khayalan dan fiktif,1
1701,"Menurut laporan WHO, Corona Virus adalah yang paling banyak bertahan di lapisan kubis",1
1702,Infografis COVID-19 (24 Mei 2020),0
1703,”Kabar Baik: Persentase Kasus Aktif Indonesia di Bawah Angka Dunia”,0
1704,dokter gigi di Surabaya stres telanjang di jalan karena suaminya dan anaknya mati kena covid,1
1705,Harga Vaksin di Indonesia 1000% Lebih Mahal Daripada di Brazil,1
1706,Sekelumit Dinamika Komunikasi Publik Selama Dua Bulan Pandemi COVID-19,0
1707,Kebijakan Lockdown dan Menjaga Jarak Merupakan Strategi untuk Mencegah Revolusi,1
1708,Jubir COVID-19: Jangan Kembali ke Jakarta Dulu,0
1709,Bantuan Pemerintah Bagi Koperasi dan UMKM Penunjang Adaptasi Bisnis pada Masa Pandemi,0
1710,Dokter Italia Sengaja Membunuh Pasien Virus Corona,1
1711,Alur Registrasi dan Verifikasi Sasaran Penerima Vaksinasi COVID-19,0
1712,"Klaster Supermarket Sendy’s, 28 Pegawai dan Pemilik Swab",1
1713,WHO menyatakan bahwa vaksin Sinovac adalah vaksin yang paling lemah,1
1714,Perlindungan Diri Jadi Pertahanan Tenaga Kesehatan  ,0
1715,Pedangdut Elvy Sukaesih Meninggal Dunia,1
1716,Warga MB Ketapang Kotawaringin Timur Sudah Diperbolehkan Shalat Jumat dan Tarawih di Masjid,1
1717,Satgas Covid-19: Jangan Sampai Keterbatasan Alat Kesehatan Menghambat Hak Masyarakat,0
1718,KPPPA: Hasil Survei AADC-19 Sebagian Besar Anak Waspada COVID-19,0
1719,Infrastruktur dan SDM Indonesia Siap Lakukan Vaksinasi COVID-19,0
1720,Empat Strategi Pemerintah Atasi COVID-19,0
1721,"Pasien Sembuh COVID-19 Menjadi 1.954, Sebanyak 18 Provinsi Tak Laporkan Kasus Baru",0
1722,Pemerintah Tengah Siapkan Skenario Kembali Produktif di Tengah Pandemi COVID-19,0
1723,Pemerintah Perbanyak Fasilitas Uji Pemeriksaan COVID-19,0
1724,Infografis COVID-19 (1 September 2020),0
1725,"Terapi Plasma Convalescent, Pengobatan Alternatif Pasien COVID-19",0
1726,"Dari DR. Ir. Hj. Sri Nurdiati, Dekan FMIPA IPB : Banyak Yang Tidak Tahu: Ini Rahasia Imunitas Tubuh",1
1727,BNPB Efektifkan Penggunaan Helikopter pada Penanganan COVID -19,0
1728,Ini Aturan Wajib Bagi Penumpang Penerbangan Internasional yang Masuk Indonesia,0
1729,Aturan Perjalanan Diperpanjang dan Diperketat,0
1730,Apakah Vaksin COVID-19 adalah Obat?,0
1731,Vaksin Perlu Didukung Kepatuhan Masyarakat Menerapkan 3M,0
1732,"Kasus Positif COVID-19 Capai 17.025, Pasien Sembuh 3.911, Meninggal 1.089 Orang",0
1733,PPKM Bertujuan Agar Masyarakat Kembali Produktif dan Aman Covid-19,0
1734,Infografis COVID-19 (22 Oktober 2020),0
1735,"Tingkat Risiko Daerah Menurun, Satgas: Jangan Lengah",0
1736,Pemerintah Kini Miliki 20 PCR untuk Tes COVID-19,0
1737,Jangan Datang ke Jalan Melong Cikawao karena Satu RT Positif Covid-19,1
1738,Jgn lewat tenggiri gg 12.. ada 12 org yg kena sekeluarga,1
1739,Anies Baswedan Mengendarai Mobil Peti Mati,1
1740,Menu Makanan Pasien RS Darurat Wisma Atlet Jadi Perhatian Ketua Gugasnas,0
1741,Tekan Kasus Aktif Covid-19 Dengan Disiplin Protokol Kesehatan,0
1742,"Pemeriksaan Kedatangan Internasional Diperketat, Cegah Varian Baru Sars Cov-2",0
1743,Peran Aktif Para Dokter dan Peneliti di Media Sosial Bantu Cegah Penyebaran Hoaks COVID-19,0
1744,Kasus Aktif Di Berbagai Daerah Mengalami Penurunan,0
1745,Rumah Sakit Di Lockdown Karena Pasien Vaksin Covid Pertama Mulai Makan Pasien Lain,1
1746,Pelaksanaan Vaksinasi COVID-19 di Indonesia Membutuhkan Waktu 15 Bulan,0
1747,"Kemenkes: Tidak Ditutupi, Begini Alur Validasi dan Penyampaian Data COVID-19 Hingga ke Masyarakat",0
1748,Desain Helm Covid-19 Pada Kompetisi NFL,1
1749,"Anggap Semua Orang OTG, Trik Cegah COVID-19",0
1750,Pemerintah Upayakan Pemerataan Penerima Vaksin Nasional,0
1751,Indonesia satu2nya negara didunia yang pemerintahnya bahagia merelakan rakyatnya jadi kelinci percobaan vaksin dari china,1
1752,Kemenristek BRIN: Pengembangan Vaksin Corona Minimal Satu Tahun,0
1753,"Belajar Dari Flu Spanyol 1918, Pemahaman Literasi dan Perubahan Perilaku Menjadi Kunci Penanganan Pandemi",0
1754,Katanya jaga jarak mutusin matarantai eh kok konser malah rame dan doi datang lagi,1
1755,"Video Perawat Pingsan Setelah Mendapat Vaksin Covid-19, Potensi Genosida Massal",1
1756,"Badan POM, MUI, dan Para Ahli Kawal Vaksin COVID-19",0
1757,LOTTE Group Bantu Percepatan Penanganan COVID-19 dengan 30 Ribu Alat Tes RT-PCR,0
1758,Pasien Sembuh Dari COVID-19 Menjadi 357.142 Orang,0
1759,Achmad Yurianto: Tanpa Keluhan Jadi Parameter Keberhasilan Isolasi Mandiri,0
1760,Sejarah Penggunaan Masker di Dunia,0
1761,"Kasus COVID-19 Bertambah 585, Pasien Sembuh 486 dan Meninggal 23",0
1762,Pandemi Telah Berakhir dan Covid-19 Adalah Flu Biasa,1
1763,"1,8 Juta Vaksin COVID-19 Tahap Kedua Tiba di Indonesia",0
1764,"Kasus Sembuh COVID-19 di Indonesia Bertambah 16 Orang, Positif 106",0
1765,Kasus Aktif di Indonesia Masih Lebih Baik Dari Rata-Rata Dunia,0
1766,Pembuatan group WhatsApp ‘INFO WILAYAH PENULARAN COVID-19’ dan pembagian VAKSIN,1
1767,Corona Varian Baru Tidak Terdeteksi PCR,1
1768,Terapi Uap Panas dan Minyak Kayu Putih Dapat Membunuh Virus Corona,1
1769,Jenazah Pasien Covid-19 Dikubur Masih Pakai Daster dan Tidak Sesuai Syariat Fardhu Kifayah Islam,1
1770,Sosialisasi Perubahan Perilaku Menjadi Upaya Pemerintah Menekan Penularan Covid-19,0
1771,"Berinovasi, Solusi Menjawab Tantangan Pandemi COVID-19",0
1772,Pemerintah Telah Siapkan Langkah Antisipasi Lonjakan Kasus ,0
1773,"71,60% Pasien Sembuh di RS Darurat COVID-19",0
1774,Corona Virus adalah BOHONG. bukan dari Virus tapi dari Bakteri. semua ini diketahui oleh negara Itali,1
1775,Gubernur Riau dikabarkan dilarikan ke ICU RSUD Arifin Ahmad,1
1776,Menghidupkan Kembali Kearifan Lokal Cegah COVID-19,0
1777,Analisis Data COVID-19 Indonesia (Update Per 09 Agustus 2020),0
1778,Dokter Reisa Sarankan Ganti Masker Setelah Empat Jam Pemakaian,0
1779,Foto di Tengah Pemerintah Sibuk Melawan Corona Anies Sibuk Main Bola dengan Anaknya,1
1780,"Apabila ada masyarakat tidak mampu makan, dapat menghubungi nomor pengaduan Bansos Covid19 Kemensos",1
1781,Video Ibu ini cuma dapat bantuan beras 1 liter dan mie instan 2 bungkus untuk 4 bulan,1
1782,Pemerintah Tidak Mentolerir Aktivitas Politik Dalam Pilkada Yang Berpotensi Meningkatkan Penularan,0
1783,"Adidas menawarkan 3100 Sepatu Gratis, T-shirt dan Masker",1
1784,"Menyambut Idul Adha, Wiku: Perhatikan Zonasi Risiko Daerah",0
1785,"Mitos Vaksin Salah, Faktanya Vaksin Aman",0
1786,Inilah 6 Jenis Vaksin COVID-19 Yang Ditetapkan Pemerintah,0
1787,corona virus sudah viral di iqro,1
1788,Sistem Informasi Satu Data Vaksinasi COVID-19 Hindari Informasi Ganda,0
1789,Kemenhub Terbitkan Aturan Pengendalian Transportasi Menuju Masyarakat Aman COVID-19 dan Produktif,0
1790,Tim Pakar COVID-19 Tidak Merekomendasikan Penggunaan Ruang Disinfeksi,0
1791,Pemerintah Ambil Langkah Antisipatif Guna Optimalkan Fasilitas Kesehatan Covid-19,0
1792,Infografis COVID-19 (6 November 2020),0
1793,Kesembuhan di Indonesia terus Meningkat,0
1794,"Lakukan Semua: 3M, 3T, dan Vaksinasi",0
1795,mayat positif covid 19 dikuburkan masih menggunakan daster (tidak sesuai dgn syariat fardhu kifayah islam),1
1796,Sebanyak 89 Laboratorium Aktif Periksa COVID-19,0
1797,PASAR TANAH ABANG DI TUTUP SEMENTARA,1
1798,Awas Hoaks Video jarum suntik menghilang saat proses vaksinasi,0
1799,Pesan Singkat Rektor Unsoed soal Dana untuk Mahasiswa,1
1800,15 Juta Bahan Baku Vaksin Sinovac Tiba di Indonesia,0
1801,Kondisi Jenazah Korban Covid-19 Di Rumah Sakit Osmania India,1
1802,WHO Sebut Penularan Corona Tak Lagi Hanya Lewat Droplet Tapi Juga Udara,1
1803,Kenapa Butuh Vaksin untuk Atasi COVID-19?,0
1804,Infografis COVID-19 (17 Mei 2020),0
1805,LBM Eijkman Dapat Sumbangan Dana Penanganan COVID-19 Rp10 M,0
1806,Penanganan COVID-19 Pada Provinsi Prioritas Guna Menekan Konstribusi Kasus Nasional,0
1807,Kota Manado Zona Hitam Covid-19,1
1808,Servis Mobil Gratis Suzuki Peduli Covid s.id/SuzukiPeduliCovid,1
1809,Kelompok Masyarakat yang Tidak Bisa Diberikan Vaksin COVID-19 dari Sinovac,0
1810,Pemerintah Finalisasi Roadmap Vaksinasi Nasional,0
1811,Cerita Para Dokter Sekaligus Influencer Dalam Mengedukasi Masyarakat di Masa Adaptasi Kebiasaan Baru,0
1812,PBNU: Protokol Kesehatan Wajib Diterapkan,0
1813,UNICEF meminta sekolah agar memiliki rencana pembelajaran jarak jauh dan akses ke layanan penting Beranda »,0
1814,Pelaksanaan Vaksinasi COVID-19 di Indonesia Butuh Waktu 15 Bulan,0
1815,"Sikapi Kepulangan WNI, Simak Protokol Kesehatan di Pintu Masuk Negara dan Kawasan PSBB",0
1816,"Corona Merebak, Gibran Salahkan Rakyat Tak Patuhi Aturan Pemerintah",1
1817,Modal Pemulihan Ekonomi 2021,0
1818,Foto Anies Baswedan Masuk Peti Mati,1
1819,"KASAD klarifikasi, anggota TNI di bandung ternyata rata2 membantah Positif kena Covid 19",1
1820,Presiden Jokowi Dukung Penuh Fase Uji Klinis Vaksin Covid-19,0
